explanation_text,author,is_author_ct,explanation_sentence_count,explanation_word_count,explanation_nesting_level_count,explanation_score,parent_submission_id
Emergency room will cut it off if things get desperate.,TCNW,False,1,11,1,1432,yo4x1j
"The guy tags it serious answers only, then tells people he might go to sleep and deal with it later. You are the one who needs to be serious. Act now to get the ring cut off like people said or deal with at minimum bad nerve damage in that finger and at worst amputation of said finger",madmax727,False,4,61,1,2947,yo4x1j
It’s time to get it cut off before you have permanent damage to your finger. Seriously.,txgirlinbda,False,2,19,1,650,yo4x1j
"Nurse here: you need to get that off pronto! Jewellery store, fire department or the emergency room. If it was a cock ring you’d already be there……….",hickorydickoryshaft,False,4,35,1,918,yo4x1j
"Firefighter/medic here. We remove rings regularly. There’s a couple of “hacks” we’ll try first, and if those don’t work, it gets cut. Our cutters only remove about 1/16th” of material, and depending on what the ring is made of, it can be bent off and back into shape to be repaired.

Certainly don’t go to sleep and deal with it later. Don’t lose any fingers by being stubborn",dustynutsss,False,10,88,2,729,yo4x1j
[Allow me](https://www.reddit.com/r/howto/comments/yrhl6s/the_door_i_fixed_all_it_took_was_bondo_patience/ivuhorf/?utm_source=share&utm_medium=ios_app&utm_name=iossmf&context=3),first-of-her-name-,False,1,22,1,440,ywbxy4
Do the same to the other three corners and make it a feature.,Iseefalsepeople,False,1,14,1,487,ywbxy4
"If this is a piece you care about, put some 60 grit on your sander and begin to smooth the curves out. Work your way up the grits to 220, then stain with something that matches and finish with poly. This doesn’t look like an heirloom piece so this is just character.",whiskeybonfire,False,5,58,1,111,ywbxy4
Do that ramen noodle and super glue trick,ConsiderationLife128,False,1,8,1,394,ywbxy4
"This is why they invented [brass table corners / edge guards. 
](https://smile.amazon.com/s?k=brass+table+corners&crid=6353KRA1JX5U&sprefix=brass+table+corner%2Caps%2C140&ref=nb_sb_noss_2)

 Also available in other finishes, but brass is classic. Make sure they're big enough that you can sink screws into undamaged wood. 

Find some that are the right dimensions to cover the whole damaged area and put 'em over all four corners of the table.

If you're not already a skilled woodworker, the corner guards will be much easier than doing some tricky bevels to make all the corners match.",Wurm42,False,6,99,2,40,ywbxy4
Your drivers license is in the fruit bowl incase you cant find it.,Edible_Magician,False,1,15,1,1473,yt52fn
"1. draw a line (or put painter's tape) anywhere on the arch so that it crosses the curved part of the arch at both ends.
2. measure that line from where the ends cross the arch and mark the center
3. Draw a line out from that center point at 90 degrees using a square.
4. Repeat those three steps at another point on the arch
5. Wherever your 90 degree lines cross, that is the exact center of your circle.

[Here's a sketch](https://imgur.com/a/6EZnCZs) that may help make sense of this

Edit: as /u/Woogabuttz sstates below, this intersection point is NOT where the nail or hanger goes - it's the center of both the arch and the wall hanging.  Should be simple to find that location once you know these center points.",StudioRat,False,10,163,2,692,yt52fn
Make Banana bread instead lol,alkt821,False,1,5,1,37,yt52fn
"Measure from left to right on the parallel edges to find the center. That’s the diameter of the arch. Half of the diameter is the radius. 

Measure the radius from the top of the arch, and from the side of the wall, that will be the center of the arch.",hmmimnotcreativeidk,False,5,58,2,125,yt52fn
"Make a cardboard  circle the Sam’s size as the shelf. 

Mark where the hanger brackets are in the shelf as well the centre of your circle. 

Measure the diameter of the circle(wall to wall) mark the centre. 

Take the same radius measurement and mark down that height from the top. That will be centre

Use the centre point with your template and the new centre point you determined to mark the mounting points on the wall. 

Probably going to need wall anchors(plugs) and screw it. If the screws are not black use nail polish to paint the heads.",sparky319,False,8,114,2,63,yt52fn
"That's a moka pot, you can Google how to use it but....


Fill the bottom part with water, not all the way, check for a screw, nut or marker. 


The small part with the spoke, top part gets coffee grounds, don't pack tightly, place on top of bottom part. 



Screw or lock on the top part and place on stove top burner. When the coffee comes out the middle, that's when you lower or completely turn off the heat or you'll burn the coffee and it will spray everywhere. It'll take a few tries to get it just right but it's so good when it's done right.",arturovargas16,False,14,131,2,105,ysamt2
"Oh man; what a great post to wake up to.

This was me 15 years ago when my girlfriend (now wife) bought one to leave at my house so she could make cafe con leche when she came over.

Enjoy your most excellent coffee; I’m a firm believer that moka pot coffee is best coffee.",mixedliquor,False,3,65,2,396,ysamt2
"I've been using these for 30 years. 20 years of that was enduring bitter or burnt, rubbery tasting coffee (from letting it sit gurgling and hissing away on the stovetop too long) and occasionally, a mysteriously really good brew. Then, 10 years ago, I cracked it!

My tip is to only let about 2-3 centimetres come through - when you get a bit of crema appearing. 

Quickly get it off the stove and run cold water over the bottom section to cool it down and stop any more coming through. This way you only get the good stuff and avoid the bitter tail. 

Now you'll have quite a thick brew that needs water added to it. I find an equal measure of water to coffee is the best ratio. I use a cocktail jigger to do this for each cup - 1 part coffee to 1 part water.  

Top it up with hot milk (or water) You can make a really excellent cup of coffee this way.

Also, using filtered or even distilled (demineralised) water in the pot can make a big flavour improvement.

I will also make a few brews and funnel it all into a bottle through a paper coffee filter to strain out any grounds that can also add bitterness. You can then keep your brew in the fridge for iced coffees or your morning hot coffee.

Edit: I should say, I have a 6 cup pot - smaller pots may require an earlier cut off point. Try to get it under the cold water tap before it really starts hissing and spitting through - it's bitter-coffee town once that happens as far as I'm concerned.",Monkbrown,False,24,322,2,12,ysamt2
Put water in the part on the bottom right of your photo. Add your espresso grounds in the part on the bottom left of your photo. That part sits in the water (pointy part down). Screw on the third piece and put it on the stove to make your coffee.,shesbehindyou,False,4,56,1,53,ysamt2
"It’s a stovetop espresso maker. I use it the way u/featherwolf said, but I use a fine or espresso grind, and really pack it firmly into the basket. Once your espresso is made, you can add hot milk for cappuccino, or cut it with hot water for cafe Americano.",Blue85Heron,False,7,59,1,81,ysamt2
Like somebody else said a rod (wooden is enough) through the books and the shelves on both sides will keep everything solid. Can't get much simpler than that,UrbanScientist,False,2,32,1,139,ypjk1p
I'd use steel brackets and mount the shelves directly to the wall and then hide the brackets with books,hard-work1990,False,1,20,1,37,ypjk1p
You shouldn't,theradrobert,False,1,3,1,14,ypjk1p
"Wood 

Book

Book

Book 

Book

Wood

Book

Book

Book

Book

Wood

Book

Book",redEPICSTAXISdit,False,1,25,2,13,ypjk1p
The difficulty in getting it levelled with a bunch of random books though?.?.?.,FireRanger720,False,2,19,1,23,ypjk1p
Original lath and plaster wall.,Recon0215,False,1,6,1,472,yhju6s
"It's plaster and lathe. People are giving you at best very ""eh"" answers and nothing really actionable.

This article explains precisely how to do it and what materials to buy ([https://www.thisoldhouse.com/walls/21015878/how-to-patch-plaster-walls](https://www.thisoldhouse.com/walls/21015878/how-to-patch-plaster-walls)). I've done this repair myself about 10 times and it works great. The plaster magic kit is 100% worth buying and makes this repair dead simple.

I recommend for the finish coat with the dry wall to wet sand with a sanding block as it will go slightly faster and you won't coat your entire house in drywall dust.",nkdeck07,False,6,108,2,179,yhju6s
Looks like a good spot for a large painting,Aggravating-Street28,False,1,9,1,391,yhju6s
"Good old lathes. You need to rack out old mortar ,then use a new line mix (with horse hair for authenticity on the first coaT) ram it on hard so the plaster goes through the racks to form a “hook” . Scratch when hardened then finish off with a nice lime top coat.",Pinkskippy,False,4,60,1,458,yhju6s
"I have this in my home and although I can *barely* figure out how to get things hung on the walls, it's the best insulated and warmest home I've lived in.",ArrArr4today,False,3,37,1,77,yhju6s
"If your only renting the house then maybe it’s not your concern but if it is , the correct way would be to turn the water to the sprinklers off and have the system blown out with an air compressor and unplug the control panel.  All you have to do in the spring is plug it back in and turn the water on  .",Pleasant-Ad-4116,False,3,68,1,131,ysv59g
"Living a rental house that has this sprinkler system. Not sure if there's even water in it since we haven't ran the system, but they just left it uncovered. Tonight's the first freeze of the year and it occurred to me that maybe it's a problem that it's uncovered. Should I be worried?",ihateredmonkeys,False,5,63,1,35,ysv59g
Disconnect that backflow device and put it in the garage for the winter,MacSanchez,False,1,13,1,31,ysv59g
"Where you live is freezing a winter-norm or is tonight just a one off freeze temp? If it's a one time thing you could open a valve to keep a mild current flowing, which will make it take longer to freeze",one9eight5,False,3,46,1,5,ysv59g
"You got good advice from many people, my only point is that it takes consecutive days of freezing to damage the plastic pipe and innerds of the back flow so you do have some time to get it blown out. One cold night won’t kill you but shutting off the water inside and manually opening that valve in the ground is not going to hurt things if you’re worried!",you-look-adopted,False,3,74,1,3,ysv59g
"Pull harder. They almost all  just pull straight out of the bottom. Once you hit the stop, pull some more.",macolaguy,True,4,25,1,319,yorw1z
"Once you get the wheels out: try this life altering purchase.

They make ""roller blade"" wheels for office chairs. They won'd damage your floors and you don't need one of those crappy plastic chair mats. 

You can buy them on Amazon.",ByGraceorGrit,False,4,51,2,64,yorw1z
Pry them out. 6-years in the office supply business. They have a split ring on the shaft a bitch to get out sometimes but they will come out. I use a flat crowbar type prybar to remove them when stubborn.,Monsterhose,False,4,46,1,17,yorw1z
Pry them out.  Maybe a pickle fork?  The only design I am aware of is push in.,ed703,False,3,22,1,8,yorw1z
"When you get them off, put roller blade wheels on them",QAOP_Space,True,2,12,1,7,yorw1z
"This happened to me once, we vacuum it, worked like a charm",aherrerias,True,3,14,1,183,yepk07
"I've dealt with this previously for a client. 

I used a small screwdriver to scrape away at the silica until it broke up enough to fall out.",Oden_Drago,False,3,31,2,86,yepk07
It’s solved! The screwdriver brute force option did the trick! Thanks!,johnnytretas,False,3,15,1,78,yepk07
"If you do go the super glue route...then use Super Glue Gel, not the regular runny superglue",SignedJannis,False,2,20,1,34,yepk07
"I'd try other sticky things before superglue: silly putty, playdough, tape, even other types of glue. Did you try vacuuming it out?

Superglue would definitely work, but it can be messy so I'd keep it as a last resort.",symmetrical_kettle,True,7,50,2,37,yepk07
error,error,False,0,0,0,0,error
"They're made of brass, works like these are relatively common from India, either turned or cast, sometimes both.  There are a number of means you can use to polish them,  you could use brasso, barkeepers friend, ketchup, most generic Colas.  For a situation like yours where there is green present in the patina the metal has begun to corrode. Those spots will need more abrasion  and will most likely show signs of some degradation of the surface.  I recommend lemon juice and flour, make a thin paste with it and work it into the surface with a sponge or cloth to prevent excessive abrasion.  Take care with all the spots that are painted. I hope this helps.",Arrid_King,False,15,139,1,94,ydwv7f
Always Czech before you Polish,XerauxTolerance,True,1,5,1,32,ydwv7f
Brasso,overtherainbow006,False,1,1,1,100,ydwv7f
Brasso is what is used in India.,qdz166,False,1,8,1,9,ydwv7f
I’m glad to see a banana for scale,Interesting-Kiwi-109,False,1,9,1,134,y5icyz
As per picture the safe is open? I would start with searching online for the manual how to set a new combination. Hoping the current combination is not required for that,adrenalynn,True,3,33,1,362,y5icyz
"This is the lockpicking lawyer and what i have for you today is a dial safe. We are going to decode it, all you need is a flat shim of metal and a sensitive finger.",disorderly_ants,True,3,38,1,160,y5icyz
"Open the rear of the combination lock with a screwdriver, turn dial in alternating directions until the lever lines up with the notches in the wheels at the back (look at the number on the dial face as they line up and record them). Once the lever drops in, you have your existing combination.

Edit: Make sure you make at least 4 rotations before dialing the first number; all three wheels have to be rotating.",MooseHimself,False,5,85,2,119,y5icyz
It’s open so remove the cover on the inside. Turn the dial counterclockwise until cam one’s grove is at 12 o clock. Note the position on the dial this is your first number. Turn clockwise until the second cams notch is at 12 o clock. This is your second number. Counterclockwise agin line up last cam write down number and you have it,Monsterhose,False,6,70,1,21,y5icyz
Looks like the AC wires are in a plug. You should be able to pull it out.,Strayw0lf,False,2,19,1,383,yd6aa4
"Disconect

Replace battery

Reconect

Let dangle",yeusus,True,1,9,2,189,yd6aa4
Unplug wires.  Pull door open.  Replace battery.  Plug wires back in.,bigfatmatt01,False,4,18,1,9,yd6aa4
"I actually know the answer. Disconnect the wires (requires squeezing the edge locks). Then use a screwdriver to pry open the battery door. Remove the battery. And note there will be a spring-loaded arm that pops up that has to be depressed when installing the new battery. Close the door and reattach the wires. Test by holding down the test button. After the alarms sound, twist it back in place.",GlocalBridge,False,9,83,1,8,yd6aa4
I've got the mains off. But every time I pull on the wires to try to disconnect it the test alarm goes off.,Charcobuddy,False,2,26,1,48,yd6aa4
"I think when we buy sheets they say something like deep or extended. I can't remember exactly and I threw away the packaging but the sides are longer.

ETA: And we use the little corner stretchy clips too.",eatshoney,False,3,44,2,177,yl4uo2
"Sheet clips will work, but your mattress is actually too thick for that sheet, in general.


Get ""deep pocket"" or ""deep fitted"" sheets. They're much better at containing the mattress toppers so many of us have, and if you change mattresses the deep ones will likely fit much better.


We have the 6"" purple mattress, it's AMAZING, but it's also super duper thick. No other sheets fit aside from deep pocket sets.


I still remember, as a kid, having that fitted blanket snap up on you and tangle you up. No good.",Garage_Sloth,False,14,117,2,111,yl4uo2
[Threshold](https://www.target.com/p/queen-300-thread-count-ultra-soft-fitted-sheet-white-threshold-8482/-/A-14196336) sheets from target are hands-down the best sheets I’ve ever had - they have an elastic band built in around the corners to keep them from slipping off and they fit mattresses up to 18 inches thick,hannick9,False,1,63,1,24,yl4uo2
I feel like the sheet clips need to run the whole length of the bed though because they still come off! I would love a better solution!,mgc360,False,2,29,1,16,yl4uo2
"I had the same problem.  I solved it by purchasing 
 sheets a size larger and have most of the excess on my side and tucked under the mattress.

FYI, I tried bed suspenders and sheet clips which would only give me an extra day or 2 before the sheet pulled away.

I hope that helps.",FallingUp123,False,5,64,2,13,yl4uo2
 OP waiting with sticky hands waiting for Reddit to come to the rescue.,karlywarly73,False,1,15,1,773,yajgqr
And keep kneading,gutterballturkey,False,1,3,1,205,yajgqr
Ditch that cutting board too. That countertop below it would be much easier to knead on. Add flour in small portions and keep kneading. It will come together and start looking like a cohesive dough in no time.,lacks_a_soul,False,4,42,1,127,yajgqr
"Thanks everyone for the tips and advice, it turned out pretty okay in the end!

https://imgur.com/a/9E7l630",shanejryan,False,2,19,2,167,yajgqr
"All that has been said already and invest in a bench scraper. They’re cheap and will help you get all that into a workable round. Amazon. Get the plastic bowl scraper, too, if you plan to do this often and have a recipe that calls for a stickier dough.",Icooktoo,False,6,56,1,136,yajgqr
You might be able to clean them up a little with a flat razor blade.,MuchoGrandeRandy,False,1,16,1,107,ywsnvr
"Razor blade scraper. The kind that has the 6-8” handle and the blades lock into the end will give you more leverage to carefully scrape away the excess grout. 

You can also get a similar tool that is a grout scraper. The working end looks like a little triangle. 

It might actually be easier to scrape out all of that grout and just re-grout it all in order to be able to clean up the edges neatly. It’s un-sanded grout so it’ll scrape out fairly easily. 

 
Also, your children should be in school, not tiling your kitchen.

https://imgur.com/a/R1oeA6i/",Dirk1935,False,11,120,2,69,ywsnvr
"You can acid wash normal mortar to clean stuff like this up. I'm not sure how well that's gonna work with grout though, but it's my only idea.",DoubleDongle-F,False,3,35,1,10,ywsnvr
"We put in a grout color in our kitchen we didn’t like. I bought a $8 grout removal tool on Amazon and scraped it all out and re grouted to myself. The removal was a little labor intensive but the grouting was super easy.
You won’t have to remove it all.",deaflenny,False,4,59,1,4,ywsnvr
"We struggled with some leftovers, (a lot less than this though) - Pamper’s baby napkins was what took it.",Bombadillalife,False,3,24,1,4,ywsnvr
Unscrew the green part and interior screen and soak it in vinegar.,voitlander,True,1,13,1,351,xzvmwk
I pour CLR in a plastic bag and put the faucet in it to soak for 20 minutes then rinse. I can use that same bag with CLR znd fo other faucets and the shower head.,nanbr340,False,2,38,1,107,xzvmwk
"On a side note, that little aerator costs a dollar or so at any hardware store. If you can't clean it, don't worry about it.",Wesgizmo365,False,4,31,1,28,xzvmwk
"I just had a great experience (lol) cleaning a heavily encrusted toilet (rock hard lime, calcium and rust) with a pumice stone. Cleaning products didnt even touch it. 15 minutes of easy scrubbing and it looks like new. 

On a lark I tried it on “rusted” nickle finish pipes. In seconds, all the crap disappeared.

Really old school and cheap!",Responsible-Pitch363,False,10,77,2,11,xzvmwk
Vinegar,Craft2077,False,1,1,1,11,xzvmwk
Hot air on the windshield for the drive.Q- do you smoke or vape? If so you need to throughly clean your windshield.,CalicoJake21,False,3,26,1,24,ydmcga
Heater core leaking coolant maybe. That or you're breathing too heavy,goodbye_weekend,False,2,13,1,73,ydmcga
Leave your window down while you’re driving. Another rule of thumb Ive heard is to turn on whatever’s the opposite it feels outside. It’s hot? Turn your cool defrost on/open windows. It’s cold? Turn your heat defrost on. I’m pretty certain that rolling the windows down while you’re driving either way will fix the issue.,Gasmoker,False,7,71,1,48,ydmcga
"Rain-x anti-fog works well, but you have to apply it to super clean windows so plan on buying window cleaner as well if you don't have any on hand. Rx Anti-fog runs around $6 for a big spray bottle of it.",SnooPineapples3572,False,4,52,1,15,ydmcga
Do you have it on recirculate? Happens on mine too. Either roll the window down a bit or take it off of recirculate (it should be a little button next to your heater controls),ShinyPointy,False,3,38,1,41,ydmcga
Is it actually a duvet within a duvet cover? Does it have a zipper or other opening anywhere? Weird that they wouldn't sew channels to keep the filling from shifting.,ForgottenSalad,False,3,34,1,498,xzjnfm
Solved: Put in dryer(tumble low) with tennis balls or dryer balls.,myfriendlikestoes,False,1,14,1,54,xzjnfm
Put in dryer(tumble low) with tennis balls or dryer balls.,matchesmalone1983,False,1,12,1,385,xzjnfm
"It is correct that you use tennis balls in the dryer to prevent what has happened to you. The other thing to know is that it takes a long time in the dryer to get the insulation dry, and until it is completely dry, it will form these masses. 

As someone else mentioned, I don't see any stitching on the fabric to make channels to keep the insulation in place throughout the duvet.  Without the channels, I don't see how you could hope to keep the insulation where it is supposed to  be.",AlienLiszt,False,9,106,2,126,xzjnfm
"If this is not a duvet cover, then you need to unsew one seam. Then spread out the padding, sew seam back together. Toss in dryer with dryer balls on low or no heat. This will help spread and fluff the padding. Then give this comforter away, unless you want to ""tie"" the padding in place with yarn. As in a tied quilt.",alienmouse1,False,9,74,1,15,xzjnfm
WTH am I looking at?,dixadik,False,1,6,1,1301,xsyhvl
"this is really disturbing me, we need another photo from a different angle. My mind can't rest until it figures out what this thing is.",FortWendy69,True,3,29,1,162,xsyhvl
This should go to r/confusingperspective ! If I didn't see the other angles I'd still be lost,gufted,False,2,21,1,100,xsyhvl
It took me about 10 seconds to realize it wasn’t two rocks stuck inside a red hot cristal vase seen from the top.,kionatrenz,False,1,25,1,212,xsyhvl
"Usually a handle fits in here to steer the bike, but my kid got these two rocks perfectly stuck. I have tried flipping it upside down and also used a butter knife. They are not budging.",Sweet_Pause2,False,4,40,1,30,xsyhvl
"Thank you! Plunger did the trick, I am now free to dispose of the corpse.",macarouns,False,3,18,1,1074,xui8m1
Plunger?,Bigjaybear2020,False,1,2,1,407,xui8m1
Wait... those hinges don't appear to be hinging anything. Looks like both sides of the hinge are attached to the door.,phyrogene,False,2,25,1,148,xui8m1
"Oh, it's quite simple. If you are a friend, you speak the password, and the doors will open.",J1D2A3,False,5,24,1,128,xui8m1
"I’ve actually seen this in a movie. Eventually, someone is going to start swinging a large axe at it, from above or below. You know it. We know it. You may as well get it over with now and just grab that axe that’s been whispering to you.",dumbthoughtperson,False,7,57,1,25,xui8m1
The black and white image is a 1936 National Geographic photo by J. Baylor Roberts. Should be out of copyright and public domain by now.,Mermaid467,False,2,27,1,125,yg5945
"Allposters.com, range of prices, for the Flying Scotsman one. Checking on the b/w photo one. 

Copyright depends on the photographer, USA artists pass out of copyright 70 or 80? years after death date, European are longer if I remember correctly.",Mermaid467,False,9,51,2,51,yg5945
"That’s the Terminal Tower in Cleveland, in case you didn’t know and were curious. Great image.",Kabearman,False,3,21,1,21,yg5945
The Library of Congress has all kinds of photos that you can order prints of. I’ve done a few myself.,BlindAssassin17,False,2,23,1,16,yg5945
If you where going to print them with the school computer using a site like rastorbator will let you expand the image a print over multiple pages. Even comes with instructions to assemble if that's something you wanted.,rossnotsoboss,True,2,41,1,21,yg5945
"It's lacquer  not paint. Do not use automotive wax without research. Some will damage the lacquer. A pure carnauba wax should be easy to find and safe. 

Also be careful with polish I have damaged the decals in the past.

You should definately get it working again. I've brought back a few of these and its easier then you may think.

Just for a quick clean I would often just use the sewing machine oil and a shop cloth.",clarke-b,False,8,93,2,209,xy2w4q
That's dull? Man that's possibly the most well preserved paint job I've ever seen on one of those old machines tbh. That could just be me though,SnackPrince,False,3,32,1,305,xy2w4q
I think it looks beautiful as is,plassteel01,False,1,7,1,25,xy2w4q
Please leave that machine alone you monster,CoupDeTete,False,1,7,1,152,xy2w4q
