explanation_text,author,is_author_ct,explanation_sentence_count,explanation_word_count,explanation_nesting_level_count,explanation_score,parent_submission_id
"So there are little tension clips holding these in place. They act like springs but look like two arms. You can reset the springs by pulling them down and gently pushing them back up. If it's due to drywall degrading, you can put a shim up where the springs contact the drywall so it will increase the tension, holding it tighter.",party_benson,False,6,68,1,1,yyljmb
"I'd take the screw out, fill the hole with motar, push in a dowel once it has solidified to a clay like consistency and once that has dried, I'd screw the curtain holde back on.",FiveFingerDisco,False,4,41,1,40,y7brqn
We had this problem.  Just sold the house.   It was easier,chancimus33,False,3,15,1,83,y7brqn
Could you drill into the wall instead of the ceiling?,xyywhy,False,1,11,1,16,y7brqn
https://www.homedepot.com/p/Durham-s-Rock-Hard-DU-1-1-lbs-Water-Putty-1-CAN/100184116,RhinoG91,False,1,1,1,3,y7brqn
"5 minute epoxy, mix in a thickener like flour until it is like peanut butter. Fill the hole with the mixture using a putty knife. Once it sets, replace the blind.   You can use wax paper to insure the patch stays and remains flat until it sets.   Work fast, before the epoxy kicks off.  Good luck.",Justbu1ldit,False,9,68,1,13,y7brqn
Commenting because I also want to know.,Scoobydoomed,False,1,8,1,9,ysyvtt
"You need to get hold of a relatively well known (anyone who's into sailing will know) book called, ""Ashley Book of Knots,"" in there, you'll find everything you need to know about doing repair jobs like this with rope, cord, marlin spike - - Everything.  Sailors have had ""work arounds"" and fix-it tricks for all kinds of jobs like this figured out for centuries.  There's no way I can explain to you here and now in a reddit post, how to do this type of work.  Find that book!  It will knot disappoint you!",Congozilla,True,11,120,1,5,ysyvtt
"It's easier to buy a new handle,

&#x200B;

[https://www.axminstertools.com/accessories/hand-tool-accessories/file-handles](https://www.axminstertools.com/accessories/hand-tool-accessories/file-handles)

&#x200B;

They're cheap and less likely to give you blisters.",7of5,False,2,35,2,4,ysyvtt
Or “How to reattach a phantom skeleton hand”,goodthingbadnews,False,1,10,1,2,ysyvtt
I went down a YouTube rabbit hole a couple months ago and found a video of a guy doing this with axe handles or something.,Young-Grandpa,True,1,26,1,2,ysyvtt
"It may look like a one handed job, but it's a slow, arduous two handed gig. Peel slowly from bottom left corner (right if you're left handed). With your other hand slowly help it along by sliding your finger between the cling film and the ""pan."" Keep it slow and keep the cling film low but taut. 

OR

Use the scissors right there!",SubconsciousBraider,False,7,78,2,82,xvnul5
It only works if you wear matching socks.,Grannyshoe,False,1,9,1,26,xvnul5
You don't.,SirCoffee1429,False,1,4,1,39,xvnul5
Run knife around inter edge of container. Done.,RIhawk,False,2,10,1,35,xvnul5
I feel your pain brother,WhiskeyShooter8,False,1,5,1,7,xvnul5
What about a Velcro strip with glue backing on affix the Velcro to the monitor with double sided tape,allmight8000,False,1,19,1,160,x9ual3
"1). Tape a chopstick (or smaller) to the back of the monitor. 

2). Impale the dude onto the stick.

3). Pat the dude on the head to make him feel better.",stoutlys,False,5,44,2,684,x9ual3
"Try Velcro, it some come with sticky backings.",Luv2SpecQl8,True,2,10,1,29,x9ual3
"Sew or glue a Popsicle  stick to the back of the figure with a couple inches sticking out below the figure, then tape the stick to the back of the monitor.",AlienLiszt,False,2,34,1,25,x9ual3
"First your going to need a pitching wedge, some ice and a buffalo, preferably stuffed for safety sake, then you’ll wanna get a Velcro strip and stick the hook side on the monitor, then stick crochet man on there and BAM! Robert is your mom’s brother.",jbaby1980,False,6,54,1,14,x9ual3
"Given it's small size, likely easiest to use a pair of vise-grips (locking pliers) to extract.  If big enough, I'd cut a slot and then use a flat screwdriver. Use a hacksaw or grinder to cut the slot",Douchetag74,False,5,49,1,12,yrgo5q
"Did you use a drill to screw it in? Try taking the philips bit out of the drill chuck, and tighten the drill chuck directly onto the screw, make sure its tight. Set the drill to low gear (""1"" usually), **reverse** the drill and back the screw out",madmikeymike1,True,6,61,1,5,yrgo5q
"If you have a hack saw, cut a slot in the end and use a flathead screwdriver to back it out.",frupp110,False,2,23,1,3,yrgo5q
"If you have two nuts which fit the pin, then screw them on side by side. Then you can unscrew the screw closest to the door, without unscrewing the outer screw. This way the pin starts to unscrew. Good luck",dickmaat,False,6,45,1,3,yrgo5q
"I’d use vice grips turn them to tighten slightly, then loosen slowly.",Gunfighter9,False,2,15,1,1,yrgo5q
Pull out the stem...the knurled part by the loop.,voitlander,True,1,12,1,4,yzk6wv
Pull on the crown at the top and turn.,__DeezNuts__,False,1,10,1,2,yzk6wv
"Um, out of curiosity, how old are you?",AzrielTheVampyre,False,3,11,1,2,yzk6wv
I think you want to adjust not reset.,cipi65,False,1,9,1,1,yzk6wv
"For context: I just won this at a raffle and I’m not the most fitness oriented person but I’d like to get more into it. Now that I have this thingy, could someone tell me A.) what it’s called, and B.) what exercises I can and should do on it.",Plantsbitch928,False,5,60,1,22,y6ge6h
"I would place my hands on the both the sides of  the padded region, lift carefully and take it to the dumpster.",backpackwayne,False,2,25,1,228,y6ge6h
"Dips, push ups, chair holds,etc. Seems like a bodyweight type of device.",KEVTalksPod,False,5,18,1,9,y6ge6h
"wtf redditors, what toxic comments... this is used for triceps dips. Add push-ups after this for some big guns!",chronicdominic,False,4,25,1,17,y6ge6h
Looks like your doing exactly what you’re supposed to.,Commercial_Help_1899,False,1,11,1,3,y6ge6h
That might be mold my guy,Clean_blean,False,1,6,1,21,yqx7dt
"It looks like that's rubber- and the mold has worked it's way into the rubber itself. If that's the case I don't think there's any easy way to get it out. Tt's trapped inside the material.  


Sometimes I wonder if they put rubbery bits like this on waterbottles so that this happens and people buy more.",LunchInSpace,False,5,67,2,11,yqx7dt
It's mold. Washing up liquid (dish soap) will sort it out,Ok-Kaleidoscope-5289,True,2,15,1,3,yqx7dt
"I'm just gonna replace the rubber piece.

Thank you!",average_weeb123,False,2,14,2,3,yqx7dt
Just put it in water+hipoclorite all night. Mold will be gone.,Jubeniak,False,2,13,1,2,yqx7dt
The pieces are made by Terumasa Ikeda.,Ray_Light91,True,1,8,1,170,xfwycl
[It looks like all the pieces are hand placed](https://youtu.be/ndv8azgrn44),OMGWTFSTAHP,False,1,13,1,33,xfwycl
Kinda looks like it's somehow made of bismuth,elsquattro,False,1,9,1,63,xfwycl
It’s quite beautiful,scotty1898,False,1,4,1,7,xfwycl
I really like those. Stunning work.,sist0ne,False,2,8,1,6,xfwycl
"What I did based on the comments

 -Initial wipe down with paper towel, no solution just dry wipe
 -Wipe it down with alcohol using a paper towel -Sprayed down with lysol
 -Left outside, 1 day in the shade (for natural wind) and 1/2 day in the sun
 -Wiped it down with a leather conditioner milk (found online) 
-Leaving it again outside (in the shade) to dry out *I’m also looking for an air purifier and dehumidifier for my room to avoid repeats

Thank you so much to everyone for helping me!",GMacdoPH,False,3,108,2,813,xbeshg
"Hey I remember this, thanks for doing a follow-up!",herrht,False,2,13,1,442,xbeshg
"Thank you for the follow up!! Always love to see how things turned out. Don’t be surprised if the mold pops up again (can be stubborn - as a leather jacket of mine can attest), but dehumidifier/air purifier can help, and it sounds like you have a successful practice for getting things back and beautiful again!! Will take you advice if we have this issue pop up again at our house!",FlightyFly,False,6,84,1,41,xbeshg
This is why I love Reddit and the r/howto family,MiliTerry,False,1,12,1,10,xbeshg
"Looks really good, I had seen your original post. I'm happy for you. Hopefully it lasts you many more years.",ScumbagInc,False,4,25,1,46,xbeshg
Nice try Van Gogh painting protester,RIP_lime_skittle,False,1,6,1,133,y4q3vu
Nail polish remover,Prudent-East7034,False,1,3,1,54,y4q3vu
"Always have acetone (found in most nail polish remover), nearby when working with superglue.

I seen a post yesterday of someone using superglue to glue her eyelashes on.
She glued her eye shut.
Acetone in the eye cant be good either.",madlad202020,False,5,52,2,21,y4q3vu
Let it wear off over a few days. Nothing to be concerned about,BigDaddyDusty,False,2,14,1,12,y4q3vu
You gotta touch your genitals before it drys.,axolotl_rebelde,False,1,10,1,11,y4q3vu
"This should help: 

https://docs.chargriller.com/article/502-moisture-in-thermometer


Although I have never done this, so I can’t say personally if it works.",Intelligent_Soul,False,2,24,2,76,xmx1fx
Go to the fridge & take out a beer. Sit down and enjoy it and forget about this.,JesuisAnnie,False,2,20,1,57,xmx1fx
Use your BBQ,JorritJ,False,1,3,1,93,xmx1fx
Put the bbq in a bowl of rice overnight.,markoroje,False,1,10,1,307,xmx1fx
"Wouldn't  a fire in the grill dry it out? Is it a thermometer  or a thermostat, what's  it  control?",elderlyelephant,False,3,28,1,52,xmx1fx
Remove it from the wall.  Get rid of the ez anchor drywall anchors and use a small toggle bolt in the same hole.,getzapped134,False,2,26,1,86,y0wx0o
"Since the hole is already huge from the screw anchor, get a butterfly anchor (toggle bolt anchor)",texansfan,False,2,20,1,17,y0wx0o
move.,Chancinit,False,1,2,1,5,y0wx0o
Ditto on toggle bolts. This is the way.,kryptosthedj,False,2,10,1,5,y0wx0o
error,error,False,0,0,0,0,error
trim the end and singe it with a lighter!,novvvaaaa,False,1,10,1,842,wuy9u5
"Some materials, you can singe the end with some heat and it melts it slightly but you need to be careful. Alternatively, you could glue a bit of card to the end to protect it.",neltorama,False,4,39,1,56,wuy9u5
Fray check glue,Proper_Fox_3773,False,1,3,1,113,wuy9u5
Clear nail polish on the end,Iwannasleeptillnoon,False,1,6,1,66,wuy9u5
"Cut it and dip the end in liquid wax, or burn the end, both works, heck a tape would work too, whatever suits you",0QuietKid,False,5,28,1,11,wuy9u5
"Leave it plugged in with its own (included) charger for a long time - at least overnight, possibly a day or two. I've had a few devices (not one of these) that would not be recognized by a charger when too low but eventually would be.

If that doesn't work: overnight with a low-power charger that was not included. Basically the simplesgt charger you can find that provides the right voltage but low amps. (Trickle with as little electronics as possible). This latter move is not something I'd do in a high-risk place - there is a potentially flammable battery in there.",armouredqar,False,7,124,2,79,xm4123
"There are two possibilities - the battery protection circuit sees that the battery is too far discharged, therefore it's at risk of fire/explosion and not letting you charge it to reduce the risk, or the batteries themselves are fooked. 

You could bypass the protection circuit and charge them yourself... but there is significant risk in that, and if the batteries are hooped, nothing will fix them.  They undergo permanent changes when overdischarged.",ppardee,False,8,85,2,136,xm4123
"If you dont have a dedicated LiPO/LiON charging system, don't bother. If you do, like ppardee said, a battery protection circuit is failing 'closed' so it wont charge the batteries.  You'd need to take this apart to get to the individual batteries.  If you measure and see that the batteries are less than 3 volts, they may puff up and vent if charged aggressively.",plastiqsquadron,True,8,82,1,11,xm4123
"I have a couple of bricked power tool batteries, and the method to get them to charge again requires disassembly, checking each cell for positive and uniform voltage, and applying very brief 10-15 second charging spurts directly on the battery terminals, and then quickly plugging in the charger the normal way. Be ready for a fire though, this is not guaranteed to work, and any bad cell in the pack could cause a fire.",doghouse2001,False,8,84,1,8,xm4123
My Limsmir I think it called did the exact same thing. Worked awesome and then went completely bricked. Pretty lame I am looking into the sane thing maybe it got too drained. I know you can put a bit of charge into some tool batteries so that the charger will recognize it as needing charged in kind of hoping for same thing on my power pack but 🤷🏼,Phirstnamelast,False,5,72,1,16,xm4123
Toggle bolts are your next option.,pikeslayer1,False,1,7,1,34,y2m1pu
"I wouldn't consider those plug anchors to be drywall anchors, as they don't really grab well. My preference is the spiral-type ez anchor for most jobs. Beyond that a toggle bolt will do it.",jld3sign,False,4,42,1,18,y2m1pu
You can get much nicer drywall anchors. Alot nicer,SirachaHoney,False,2,10,1,7,y2m1pu
Toggles,Single-Criticism2541,False,1,1,1,6,y2m1pu
error,error,False,0,0,0,0,error
"It looks like the same fridge I have. Check the freezer drawer at the bottom, make sure it is shut all the way",kfields444,False,3,25,1,34,yl7dtp
"What senses the door? Is there a switch inside? Check that switch, try pressing it, it is either out of place an isn't getting pressed for some reason, or maybe broken itself.",someaholetookmyname,False,6,39,1,6,yl7dtp
"Q: When is a door not a door?  


  
A: When it's ajar!",wagonovsky,True,3,18,2,3,yl7dtp
Black tape worked on my check engine light.,ProfessorBackdraft,False,1,9,1,2,yl7dtp
"Post your model number and I can help more specifically with locating your sensors. They are much less obvious nowadays. This looks like a Whirlpool so it will start with something like WRF, WRX, or WRS most likely. 

Have you removed the upper plastic panel above the refrigerator?",bdubelyew,False,6,55,2,1,yl7dtp
"That is the only way. Those things are the worst, and they aren’t even that great of anchors either.",Virulent82,False,3,23,1,6,yemkuf
I can see them still tear the wall down and start over.,streetmichael90,False,1,13,1,3,yemkuf
"This is the way…



https://www.homedepot.com/p/FLIPTOGGLE-1-4-in-x-2-1-2-in-Toggle-Bolt-10-Pack-425R/206347693",Brudad1,False,1,7,2,1,yemkuf
They use a machine gun to shoot the anchors to the wall or what?,adorgu,False,1,15,1,1,yemkuf
Don’t bother. Tap them a bit below flush and plaster right over them.,Ardothbey,False,2,16,1,1,yemkuf
Appears to be a small segment towards the top,slothsquash,False,1,9,1,3,yyvnn1
Cut down the rod open the box and pull the wire up. Gonna want to turn off the breaker. Not in that order.,MassMindRape,False,3,27,1,3,yyvnn1
"I'm guessing there's supposed to be a small threaded bit at the top that goes through the plate and is secured with a nut.

Right now it looks like your power wire is taking all of the weight which it's not designed for.

EDIT: Changing the hang height will require cutting the down rod. If it's not threaded full-length for the insert I mention you may have to buy a new one of proper length.",dengh,True,5,88,2,3,yyvnn1
An incandescent lamp? That's a future museum piece you have there!,jakedublin,False,2,14,1,2,yyvnn1
"On some of these, there is a collet in the plate in the ceiling, allowing for the height to be changed…",davidmlewisjr,False,3,24,1,2,yyvnn1
See how the screw holes allow for movement in the second pic?  See if the latch receiver has moved.  It may need to be adjusted down.,varadins,False,3,31,1,3,yub2y8
"You can also adjust the height of the rollers on the bottom of the door, often the bearings will wear out and the door will drop a bit, if it sounds a bit rough/feels heavy while sliding the door get some new ones.",Standard_Meaning16,False,3,48,1,1,yub2y8
"The base definitely can move or slip. Those screws are just going into a relatively thin piece of metal trim that makes up the door frame. 

Measure for the bottom of the door to the inside of the latch hook eye so you know where abouts the base needs to be for it to latch. Then loosen the screws and adjust it back to that height. Make sure to tighten the screws well. If it keeps slipping down you might use a small washer on each screw between the screw head and bracket.",DoctorModalus,False,8,100,2,0,yub2y8
Yep looks like it slipped up judging by the marks. Maybe try tapping it down with a hammer all the way down to top of the marks and tighten it with a better screwdriver.,americancharlie,False,2,36,1,0,yub2y8
"Do you have a similar tall post to the left of the picture, that is going to be the other gate post? And the shorter post by the house is for a man-gate?",dumbthoughtperson,False,3,38,1,18,xsuvep
Don't think so but it would look much better cut to matching fence post height.,gooberfaced,False,1,17,1,33,xsuvep
"My big box store in the midwest, sells this ""kiln-dried"" lumber but I think they just drive the truck load past the kiln and call it good.",coopertucker,False,3,33,1,6,xsuvep
"No, but i learned my lesson from a similar situation. Never buy 4x4’s that were made from peeler cores. Look at the end grain of the 4x4 when you are buying them and if you see full rings with the center thats what it will do as it dries",cherrycoffeetable,False,4,54,1,14,xsuvep
"Larry, go get the board-straightener off the truck.",whiskeybonfire,False,2,12,1,6,xsuvep
With a corkscrew?,srqwert,False,1,4,1,68,yn30wg
"I know you posted this a bit ago, but just a heads up, once you take the muselet off, sometimes the pressure will continue to build in the bottle and force the cork out. It will fly out as if opening a bottle of Champaign with no control.",MackAttackATO69,False,5,53,1,9,yn30wg
"If you can't get a corkscrew in, try drilling a starter hole first.",John_B_Clarke,True,2,16,1,5,yn30wg
"If it isn't cooled, you can try with a lighter or torch. If not, let it get to room temperature. Remove the foil on the neck and apply a torch/lighter fire on the neck below the cork. Heat it up while rotating it, and the cap will pop off.",Specific_Function_83,False,7,59,1,2,yn30wg
Shake it,Disastrous_Policy_99,False,1,2,1,4,yn30wg
"I would assume it’s not a fannypack, then. Maybe just a purse?",neighbor_mike,True,3,16,1,6,yjsmpa
Is it supposed to be worn cross-body?,_Elon_Muskrat_,False,1,10,1,3,yjsmpa
Wear it with suspenders.,CobraCornelius,False,1,5,1,3,yjsmpa
Looks to be a purse that looks like a fannypack,Jingleheimer_smyth,False,1,10,1,2,yjsmpa
Wear it at a jaunty angle over your hip?,Em_Adespoton,False,1,10,1,2,yjsmpa
https://www.homedepot.com/p/Leviton-White-3-Gang-2-Toggle-1-Decorator-Rocker-Wall-Plate-1-Pack-R52-PJ226-00W/202059834,chiphook57,False,1,1,1,393,wkasqu
Change the switches out for Decora style and a standard three-gang Decora cover will work.,dengh,True,1,18,1,280,wkasqu
"[Home Depot](https://www.homedepot.com/p/Leviton-White-3-Gang-2-Toggle-1-Decorator-Rocker-Wall-Plate-1-Pack-R52-PJ226-00W/202059834) and other stores carry a bunch of variety. But you might need to adjust the straightness of the switches and plugs so they fit inside correctly. The exposed metal isn’t electrified so you should be able to adjust them to fit within the plate.

Edit: clarification",acewavelink,False,4,82,2,65,wkasqu
Double Toggle and GFCI Decora Rocker Wall Switch Plate Outlet Cover,ineedabeer6,False,1,11,1,61,wkasqu
"Lowes and Menards sell snap together cover plates that let you kind of make your own. Might work also, not sure

https://www.lowes.com/pd/Eaton-1-Gang-White-Midsize-Wall-Plate/1001462326?cm_mmc=shp-_-c-_-prd-_-elc-_-ggl-_-LIA_ELC_205_Wiring-Devices-Cords-Fire-_-1001462326-_-local-_-0-_-0&ds_rl=1286981&gbraid=0AAAAAD2B2W8UxxB1HiTNBg2yY4fRUJqSk&gclid=EAIaIQobChMIjJGE_My6-QIVyNrICh24twXaEAQYBCABEgJbB_D_BwE&gclsrc=aw.ds",TwistedK1ng,False,3,25,2,13,wkasqu
"It’s been sitting in my garage for a few years and has accumulated dust, cobwebs, and exposed to rodent waste. I want to really 🫧sanitize🫧 it and bring it inside to use, but want to make sure I don’t ruin the paint. 
 
Suggestions for how best to clean it without ruining it?

Edit: forgot to mention that this is an antique, hand painted about 100 years ago. Uncertain if it’s a water or oil-based paint.
 
Edit 2: thanks to those of you who actually tried to help.",n6mub,False,10,107,2,7,yctufw
"a little bit of dish soap in water, and a gentle rag",ForgottenSalad,False,2,13,1,6,yctufw
I would try Murphys Oil Soap and a microfiber towel.,bewenched,False,1,11,1,6,yctufw
Is that Tim Adams from AZ?,jaaronmccoy,False,1,7,1,1,yctufw
I’d say test a magic eraser on it. Those things work amazing for dirt. I wash my shower walls with it.,ChondroArt,False,3,25,1,-10,yctufw
"Change the outlet cover to wood, or black, or dark brown, paint the hardware with a flat black/oil rubbed bronze spray paint.",ETdaExtraTerresticle,False,4,28,1,228,wiedt0
Put a different colored argyle sock on each hook.,Shimasanawa,False,1,10,1,680,wiedt0
"As someone who struggled to hang an actual hanging microwave yesterday, I kinda wish I had just done this.",2317,False,2,21,1,63,wiedt0
Maybe you don’t. You definitely have an interesting space with the multi-coloured wood so maybe embrace the microwave. If it were mine I would maybe try painting the hardware to either better blend or to really stand out. Not sure and would probably try both and pick my fav. What bothers me more is the stark white receptacle and cover plate. I’d switch that to black or dark brown.,JustJay613,False,6,79,1,319,wiedt0
Big bushy potted plant,jester02k,False,1,4,1,84,wiedt0
"First order a pizza, then try all the other tips.",mardigrasman,False,2,12,1,439,x81fs8
Just rewarm it on the stove . The hot air shrank as it cooled creating a vacuum sealing the lid.,Altruistic_Drink_465,False,2,21,1,266,x81fs8
"Congrats! You just invented canning!
I agree, you need to warm it more. If the stovetop seems extreme, try the oven, which will heat things more evenly (though more slowly)",TootsNYC,False,7,39,1,215,x81fs8
Put it back on the stove.  Hot bath wasn’t hot enough.,jdith123,False,2,15,1,91,x81fs8
"Did you get it open, OP? I'm invested.",BeccasBump,False,3,12,1,58,x81fs8
It is upside down,qdz166,False,1,4,1,5,ywdohm
You need a lampshade harp. Look it up.,civex,False,2,10,1,3,ywdohm
Flip it upside down,machetebrownsugar69,False,1,4,1,2,ywdohm
"You have a few different things going on here; first and most importantly is your light socket is incomplete and a shock and fire hazard, it is missing its top. The shade you have sits on top of the missing top. 

The lamp you have is configured for a different type of shade. The other type is suspended by a piece called the harp. You have the bottom of the harp below the 1/2 socket. 

Purchase new socket. 

Remove existing socket piece. 

Remove bottom of harp. 

Install new socket. 

Install lamp shade. 

...

Profit!",MuchoGrandeRandy,False,18,115,2,2,ywdohm
"I’ve tried three adapter rings, including one that screws together, one that slips into the center of the shade and the one pictured. None of them work, how do I get this to fit properly?",Fujuug,False,5,41,1,1,ywdohm
"Push each side one at a time… one side will have a push to lock/unlock system. Most probably it’s the one opposite to the side that’s rigidly fixed

Edit:
Or it’s is a fully removable, if it were it wouldn’t be stuck that hard. 

There is no other way… full force

Also check if the sides are painted over. Use a strong knife of flat head to remove the paint.",haseebkp,False,7,88,2,8,ymq2zb
"The person who lives in your ceiling locks it from the inside, so good luck.",ohyeaitspizzatime,False,2,17,1,11,ymq2zb
"Is that metal?    Sometimes there's a little circle with a line throught it.  If you see that, it's for a flathead screwdriver.   That's the locking mechanism.  Open it and it will have a hinge on the other side.    If you don't see one of those ..... I have no idea.",AsylumDesigns,False,8,66,1,2,ymq2zb
It's possible that it's like a ceiling tile.  Try pushing up.,theonetrueelhigh,False,2,16,1,2,ymq2zb
Looks like someone cut an opening to gain access to attic area. Run a utility knife around each side.,kkdj1042,False,2,21,1,1,ymq2zb
Taper pin. Send it the other way.,jeffersonairmattress,False,2,9,1,2,yzj4hn
Are you sure it's not an Allen screw?,mutt_butt,False,1,10,1,1,yzj4hn
Is it a set screw?,oilcantommy,False,1,6,1,1,yzj4hn
Bar keepers friend,The_DonCannoli,False,1,3,1,49,xztqeo
Vinegar,BobtheBeholder,False,1,1,1,11,xztqeo
"Coat with baking soda and add vinegar to make a liquidy paste.... 1 Layer paper towel on top to cover (very important, keeps from drying out), then close with the pot lid. Leave overnight and should wipe away. 

I use this with baked on stuff that comes out of the oven, or the bottom of pots when they get that cakey brown layer that basically never scrubs off on its own, or my induction stove when it starts getting stuff stuck on that won't scrub off.",Ruckus292,False,8,98,2,13,xztqeo
"I know this bar keeper, he has a friend that cleans stainless steel effortlessly.",kkdj1042,False,2,16,1,5,xztqeo
Cook a tomato sauce in it ... slow simmer about an hour ... and you got yourself a great tomato sauce ++ a clean pot.,torben_lue,False,3,27,1,4,xztqeo
Wife and TikTok? No.,Environmental-Sock52,False,2,6,1,53,y9gkx6
