explanation_text,author,is_author_ct,explanation_sentence_count,explanation_word_count,explanation_nesting_level_count,explanation_score,parent_submission_id
Take the two grub screws out and put one of the grub screws in the third hole in middle to get the wheel off. It’s a taper-lock,Kaidrenshaw,False,2,31,1,14,yjiila
"I've tried tapping it with a hammer but it's not budging at all. Do I need a gear puller for it? Also, could someone tell me what the set screws between the outer wheel and inner plate do?",1_Highduke,False,4,44,1,1,yjiila
That is a sheave (pronounced “shiv”),Jeff_72,False,1,10,1,1,yjiila
The center piece is a wedge locked in place by the 2 Allen head screws. Remove them and lightly tap the outer ring. It should come right off.,Ardothbey,False,3,31,1,0,yjiila
"Galvanized steel backyard hose line connected to copper waterline in the wall... only noticed the corrosion when I took off the brass valve and noticed severe corrosion on the steel threading

Had to get the adjacent copper line cut and repaired. Now I have a big hole on the side of my house :(",kenthekal,True,2,57,2,16,y0xhkp
It's a new alloy!,modembug,False,1,6,1,2,y0xhkp
That'd make a mighty fine Crack pipe. How much? Asking for a friend.,poorjohnnyboysbones,False,3,17,1,4,y0xhkp
"I've been on about this for years but I feel like most people just shake thier heads when I'm talking.  Mixing ferrous and non ferrous alloys in a joint like this is just more calculated, planned obsolescence. Well that and a poor attempt at ""cost saving measures"" or whatever the lame justification is.   I honestly don't see why we're not using bronze anyway..  it's got better corrosion resistance than brass for cryin out loud.
I'm really sorry about your situation OP. 🙁
I think you could post this in r/mildyinfuriating too.",Arrid_King,False,8,114,1,4,y0xhkp
"Mixed metals isn’t the problem here, the galvanized is. I put copper to cast iron and black steel on boilers all the time without issue. Galvanized is just garbage",thatguy82688,True,4,33,1,4,y0xhkp
"Yes, you select the voltage you are connecting it to, not the appliance voltage",Haunting_Ad_6021,False,3,16,1,3,yspixy
"That looks like the one.  But, The limit is 1100 Watts.  You won't run a lot of appliances.  Most microwaves are at least 1000 watts, or more.",ArtBaco,False,6,37,1,2,yspixy
"I wouldn't advise doing this unless you know about cleaning & inspecting boilers. That model of Bryant is highly inefficient if it did work. Not to mention there could be asbestos in that model of boiler (insulated lining). it would need to be disassembled, cleaned, and inspected. Gas valves are the common thing that goes bad on these, and you would need to make sure you have gas leak detector / sensor around.

Save your self grief, get rid of this thing.",6Kgraydays,False,10,96,2,49,xtsi9o
"i know you got it lit already, but seriously - you need to call a boiler servicer.  Even new boilers need to be serviced once per year, there is all sorts of buildup inside of those things.  At the bare minimum have someone come out to inspect and service/clean it out.  Ask them what you need to know while they are there, most people are friendly and helpful.  It isn't crazy expensive.  Just ignoring it will not do you any good.",artsandfartsandcraft,False,9,98,1,8,xtsi9o
"I'm going to be real honest with you. I'd replace the whole thing, my amateur ass wouldn't risk a fire or other event...",FluffyTyra,False,3,29,1,14,xtsi9o
What controls does it have?,Haunting_Ad_6021,False,1,6,1,3,xtsi9o
Uhhh. No. You get a professional to inspect it.,natesovenator,True,3,12,1,2,xtsi9o
Do you want to use poison or do you want to wear protective gear? How urgent is this task?,ConstantFwdProgress,False,2,21,1,289,w45t8b
"If a bug bomb doesn’t work, suit up. It may be hot, but you do not want that hospital trip.",JMT2492,False,4,25,1,160,w45t8b
"Not worth it. A brown recluse bite can affect you for the rest of your life. Get some big spray and treat everything, wait, repeat, then chance it.",PerfectDarkAchieved,False,6,34,1,253,w45t8b
"Try tossing a Bug Bomb insect fogger in there like 6 hours before you start work. In Colorado, we have a few black widow spiders crawling around, so I use a Raid fogger when working under our deck.",owegotrash,True,4,42,1,297,w45t8b
"They are ambush predators. So after the bomb, do everything twice, first to disturb the area then to do what you need to do.",Half_t0n,False,4,28,1,44,w45t8b
Fake hammer?,redEPICSTAXISdit,False,1,3,1,23,xxbw9v
"I’d just plan on replacing the drywall behind it. 

Hammer drill, small sledgehammer with a 4” chisel, crowbar, whatever you’ve got. Don’t be timid about it. I’d consider putting down OSB or plywood to protect the flooring.",billdogg7246,False,8,50,2,11,xxbw9v
"Hammer and chisel or a hammer drill with a chisel bit for the stone, will mess up the drywall so will need to replace all of it or mud over the chunks torn off. If the fireplace is electric, it’s probably screwed in under the stone or inside the unit itself. Cover the floor if wood to not scratch it as chunks of stone fall off",Guccheetos,False,5,71,1,19,xxbw9v
"The stone isn’t fake, it’s just skinny",Indygoose,False,2,10,1,17,xxbw9v
I say: keep it,manowtf,True,1,5,1,28,xxbw9v
have you tried cheking on the manual what the three beeps mean?,agiudice,False,1,13,1,31,xl33kp
You need to refer to the manufacturer instructions. Check online if you don't have a paper copy. Could be a fault code.,Petrus59,False,3,26,1,7,xl33kp
It might mean that the drain line is blocked. If it is connected to a waste disposal make sure that the plug is knocked out on the disposal and there is nothing blocking the drain line. You can try resetting it by unplugging for 1 minute .,Competitive-Bat172,False,3,49,1,7,xl33kp
Google your model number and “three beeps”.,finnegan922,False,1,10,1,4,xl33kp
"I have this same dishwasher and had the same issue.  It's beeping because of the door switch but it's not actually the door switch, it's the main board at the bottom of the unit in the front.  It's easy to replace and I think the part was around $110 online from usual appliance repair websites.  I believe the site also provided replacement instructions.",Weasel410,False,6,76,1,13,xl33kp
Sounds like electrical conduit. I would call an electrician,mole4000,False,2,10,1,3,yxcqqd
Could be any type of pipe and be for many many different uses.  But it definitely sounds like it was sleeved.  Could hopefully have been just that they wanted to make it more sturdy if truly used for hanging clothes especially if it is a long distance end to end.   The only way to definitely know for sure is to trace it into the wall at each end and follow it and find out what could possibly be connected to either end if anything at all.  Look on the opposite side of each wall.  Try to find an access panel to see inside.  If on the top floor and you have access to an attic then try to locate those bays and look down with a flashlight down inside the wall and also do the opposite if this is a lower level with basement acces and looks up into the wall.  If not the only other way would be to cut away a small section of wall above or below where it connects to the wall and look with a flashlight and or camera and or mirror or reach your arm in.  Most likely this way the wall will need to be repaired after.,redEPICSTAXISdit,False,9,221,1,3,yxcqqd
What kind of HVAC system do you have? It could be electric conduit or it could be carrying freon lines out to the condenser or a vent or air intake for a furnace. Hard to tell without seeing what it connects too,I_am_Bob,False,3,44,1,1,yxcqqd
"Had it fix this a while ago myself.   The big white piece with the crank is prob broken / striped ,  the cover comes off and the whole arm comes out ( part on other side of screen ) .  Google casement window cranks and order a new one .  Just measure for correct size length and if you need a left or right crank ( it looks like a left ).  It’s a good idea to clean and lube the outside part , where it connects under the window , every year to make it last longer.  Think all you need is a screwdriver and make some silicone to reseal when done.  Pretty easy job to replace.  👍",Pleasant-Ad-4116,False,10,133,1,17,y25g95
"The crank is attached to a thin metal arm that bends that has a small wheel on it. The wheel is off the track

Take the screen off and pop your head down and look at the track along the bottom of the window and it will all make sense. Obviously do this carefully and don't fall out the window.",Harpronicus,False,3,65,2,6,y25g95
Check and make sure the handle isn't just spinning independent of the splined axle it should be attached to.,bcvickers,False,1,21,1,3,y25g95
I have these same type of crank windows at our place in Colorado. On our last visit I found two windows with broken cranks. With some help I was able to find replacement parts from Swisco. I had to order PNs 39-091 and 39-547. Check it out. Bad part is they only come in white.,rghcm,False,6,65,1,3,y25g95
"Take the plastic cover off the gear mechanism and make sure everything is tightened.  Make sure the handles set screw, if it has one, is tightened.",trtreeetr,False,4,31,1,1,y25g95
Try google calendar.,Rothyn1,False,1,4,1,2,yjv8wj
That’s just the native iOS calendar app,IsThereCheese,False,1,8,1,1,yjv8wj
Have you Looked into Goodnotes?,ToTheDreamers,False,1,6,1,1,yjv8wj
"Solution: Thanks to Rothlyn1, it looks like google calendar will be what I need.",tinatalker,False,2,17,1,1,yjv8wj
ios doesn't have a calendar??!?!?!?!🤣🤣🤣,redEPICSTAXISdit,False,2,18,1,1,yjv8wj
"you may need a new cartridge valve for H/C or both. More complicated/expensive than a washer, but same basic idea.",quatch,True,3,27,1,5,y8w4xr
"Most modern major brand faucets use proprietary designs instead of the old-fashioned gaskets. If your handles rotate from on to off without screwing down by multiple turns, you probably don't have 20¢ gaskets. Truthfully, the new designs work better.",alvarezg,False,5,47,1,3,y8w4xr
From where is it leaking?,43n3m4,False,1,6,1,1,y8w4xr
Buy a delta faucet push button diverter assembly. Easy diy fix.,Disc_n_Drum,False,2,13,1,74,x881tb
That’s a hell of a bidet,jadnich,False,1,7,1,44,x881tb
just like changing your son’s first diaper,kkeennmm,False,1,8,1,18,x881tb
"I think that's your good ol fashion butthole sprayer. Its a feature not a bug. Also yes, call a plumber",Realestaste,True,4,24,1,45,x881tb
"Not a bug, that’s a feature.",amerikinda,False,2,9,1,9,x881tb
"I’ve just looked up that part number, and it’s the right hand half of a two piece cover that goes around the rear view mirror.

http://www.catcar.info/opel/?lang=en&l=bW9kZWx0eXBlPT1HMDl8fG1jb2RlPT1PUE18fGxhbmc9PUdCfHxzdD09NTB8fHN0cz09eyIxMCI6Ik1vZGVsIiwiMjAiOiJPcGVsICBJTlNJR05JQSAoIDIwMDkgLSApIiwiMzAiOiJDIEJPRFkgSU5URVJJT1IgRklUVElOR1MiLCI0MCI6IiAxOCBST09GIEZJVFRJTkdTIiwiNTAiOiIxLlJFQVIgVklFVyBNSVJST1IifXx8c2NvZGU9PUN8fHNzY29kZT09IDE4fHxtbmNvZGU9PTF8fHNtbmNvZGU9PS03fHxpa2V5PT0xOTA%3D",Miserable_Bugger,False,2,31,2,17,yka6a2
Looks like it might be a seat belt cover maybe,sageeyes666,False,1,10,1,11,yka6a2
Looks like up under the dash below the glove box appears to be a kick panel or part of it,warturd79,False,1,20,1,5,yka6a2
100% it is half of the cover that covers the sensors where your rear view mirror mounts to the windshield. Should just be able to snap the two pieces together and snap to the bracket on the windshield.,jerarn,False,2,41,1,4,yka6a2
Take it to the dealer body shop they’ll tell you where it’s from,BaldAndGassy,False,1,15,1,1,yka6a2
"Hardwired detectors still have backup batteries,in case of power outages, look for a little drawer like thing on the detector.",mdmaxOG,False,3,24,1,5,yqbgkm
We found a place open 24 hours that sold 9v batteries.  This has fixed it… I hope!,JennXL,False,2,21,1,5,yqbgkm
"You'll most likely have to replace ALL of the batteries at once.

Had that at a previous property...replace one chirping battery, then the next one starts. Replace 2, then a third. And a fourth. Until I just got fed up and replaced all of them. 

Issue resolved.",Top_Midnight_2225,False,7,60,2,1,yqbgkm
"You can use a paper towel soaked in vinegars and place the iron on top for a few hours. 
Lay down a sheet of waxy paper and sprinkle salt generously all over it. Set your iron to warm and glide it over the paper several times in a number of different directions before shaking off the excess salt. 
Smear a small amount of white toothpaste on any affected areas of your iron soleplate. Leave it for a minute then use a clean cloth to wipe the toothpaste away.
Finally and in addition to the above fill up your iron's water tank, pop your iron on an old towel or similar, set it to steam, leaving it for a few minutes to work through.",Brittlehorn,False,9,136,1,799,vw7srj
He knows.,areyouthrough,False,1,3,1,437,vw7srj
You can buy Faultless iron cleaner at Walmart/Amazon. Rowenta also makes an iron cleaning kit - Bed Bath & Beyond has it.,LooksAtClouds,False,2,26,1,242,vw7srj
"Tablets, seriously warm the iron and find some painkilling tablets and just rub it off",128palms,False,2,16,1,30,vw7srj
"If you have some paracetamol (Panadol, Tylenol) Turn the iron on and rub the pill against the dirt. Wipe off after with a damp paper towel. Might be the cheapest fix so I think it’s worth a shot before you spend money on another cleaning agent. :)

My sister showed me this trick and it’s quite quick at taking the dirt off.

Don’t burn your fingers tho",Fiji_Ninja,False,7,79,2,29,vw7srj
"Instructions for a classic bidet:
1. Sit on it (front or reverse cowgirl depending on personal preference)
2. Open water to right temperature (this double-faucet set up is old-fashioned and quite uncomfortable)
3. Cup your hand and collect water to throw towards your nether regions.
4. Take some soap (liquid is better, you might lose the soap bar), add a bit of water and scrub thoroughly.
5. Dry with a towel

PS: STEP 0: You might want to use toilet paper before (especially if it’s a messy one)

Source: I’m Italian

EDIT: I feel I need to specify YOU DON’T POOP IN IT, you use it AFTER the toilet.

EDIT 2: I love all the questions, you’re making me wonder so many aspects of how I washed my ass for a lifetime ahaha (and thanks for the awards, I was not expecting to gain my first awards through this “shitty q&a”)",QuestFunn,False,15,198,2,2150,vb911m
"Italian girl here, no one talked about the fact that when you're on your period using a bidet is very easy instead of taking a shower every time you change a pad!
And afaik the ideal position is face to the wall bc you don't want the water from the back contaminating your gina, so it's better to wash from front to back",megsmagik,False,4,70,1,122,vb911m
"We had one growing up, with one big difference: it had a spray head built in at the front, aimed upward.",alvarezg,False,3,25,1,67,vb911m
"Like the idea of a bidet and the Japanese ones are fantastic, the European ones always seem to be at a stupid distance from the throne! I don't want to be try to waddle my contaminated ass across the whole bathroom with my jeans and jocks around my ankles....A note to anyone who might visit an Italian friends house, they generally have personal towels for the dry up after bidet, don't use them or the hand towel, use some toiler paper or just drip dry!",SuperS37,False,7,95,1,209,vb911m
Glad I have a Japanese toilet in my house,Frank_Pollet,False,1,9,1,21,vb911m
you need to unscrew the bulb from the plastic socket that is attached to it. i can see that there is that plastic socket attached to the lightbulb,Brandonncr,False,2,29,1,2,yrw050
I have a similar light. There is a latch at the top that drops down one side of the fixture so you can replace the bulb. Your fixture might have that also.,mellowmom414,False,3,35,1,1,yrw050
[pic](https://imgur.com/a/2zTGAqf),LachlanBourke666,False,1,5,1,1,yrw050
Solved: thank you 🙏! I pulled the bulb and then used the sides to press on and unscrew the bulb.,LachlanBourke666,False,2,23,1,1,yrw050
"Hand Wash  
Cool Iron  
Don't tumble dry  
Don't use bleach.  
Dry clean - but not with 'Tryc'

https://www.ihateironing.com/blog/wp-content/uploads/2019/11/The-complete-care-label-gude-min.png",ChrisHow,False,3,28,2,373,wtvta0
First icon means handwash. Best in cold water with very little ditergent.,MR_BLE,False,2,14,1,41,wtvta0
"The first sign (tub) indicates  the item is  washable. The hand inside the tub indicates it should only be hand washed. 
The sign of the iron indicates  it can be ironed. The “one” dot inside the iron indicates should be set to “silk” or low heat.
The crossed out circle inside a square therefore the item should Not be tumble dry (ONLY line dry).
The  triangle crossed out indicates NO bleach to be used.
The “P” inside the circle indicates it CAN be dry clean very delicate; any solvent except Trichloroethylene.",Sensitive-Ad-8566,False,7,117,1,26,wtvta0
"If it doesn’t survive my standard routine of shove it all in the wash and dry on medium for way too long, then it wasn’t meant to be.",No-Inspector9085,False,2,32,1,13,wtvta0
"Hand Wash

Iron OK

Line Dry only

ABSOLUTELY No Triangles!!!",johnny2fives,False,1,16,2,6,wtvta0
"Looks like that “soft touch” paint that always becomes sticky after a few years. Not sure what causes it to go sticky over time and it can’t be returned to its original state, but you can remove it with rubbing alcohol.",PINeely,False,4,47,1,34,xs38vg
"I have the answer: for real, baking soda. Put some water in baking soda so that the consistence is like doh put some on your fingers and gently rub the sticky plastic. Leave it there for a minute or so, and remove with a humid towel.

It has always worked for me on old remotes, old tools, and last week with a kitchen utensil. I am amazed every time I use it.",patval,False,9,83,2,19,xs38vg
Baking soda and water! That was it. Really good,misthi_S,False,3,11,1,7,xs38vg
"I would start with rubbing alcohol and elbow grease.  Then maybe try mineral spirits, use lightly as to not damage the plastic and wipe away with damp rag.",WebbityWebbs,False,3,32,1,6,xs38vg
If you don't feel like scrubbing the thing try putting talcum powder on it with a brush. Just cover all the sticky parts and then brush off the excess. It lasts for quite awhile and as it gets sticky again just reapply more talcum powder.,HeadBlaze,False,3,49,1,4,xs38vg
"Please don’t try any “hacks”. Mayo should be a red flag about that. If you can’t scrub the damage out with warm water and a soft sponge, you’ll need to refinish it. It’s nice and flat so it’ll be a breeze to refinish. I can elaborate on that in the future if that’s how you want to go. I’m a cabinetmaker & finisher. And get a coaster under that glass or you’ll have more work to fix!",Carlos-In-Charge,False,8,95,1,153,x1wfch
"Sand & refinish. If your mom wants to rub Polident on the top with an enchanted quartz yoni wand from the remote hills of North Carolina, she can go ahead and do that herself.",DirtStarWars,False,3,37,1,35,x1wfch
"Maybe point out that the hair dryer thing is for minor cup rings and light damage that doesn't penetrate the very top layer of an existing finish. This piece looks to not have a heavy finish in the first place, and a ""wet rug for a month"" is not the same thing as an arrant mug or glass for a few minutes.",mariemarymaria,False,3,68,1,29,x1wfch
put the Mayo on your mother then sand that thing,jpm01609,False,1,10,1,24,x1wfch
Just sand it and stain it again and tell her you used the mayonnaise method 😂,Kobe350,False,1,16,1,49,x1wfch
That solution is too liquidy and drips off the caulk so it can’t do it’s magic. Get the gel toilet bowl cleaner that specifically has bleach on it. Squirt some on and it clings on to kill all the mold over time.,sudsomatic,False,3,47,1,351,w4ehxm
error,error,False,0,0,0,0,error
"Better scratch the silicone off and put new one on it.

Edited: Silicon -> silicone",matth0z,True,2,19,2,114,w4ehxm
"When you go to replace this caulking, please use all of the techniques in this video. 

A lot of the conventional wisdom actually creates vulnerabilities for your caulking job to fail. I used to wonder myself about things like using tape on the edges, because it seemed to just lift it up; smoothing it with your fingers seemed to give you a thin edge, misting the wall always meant always seem to mean the soapy water would go places you didn’t want it to. Then I saw this video, where the guy laid out all the things I have already been thinking.


This guy points out all the problems with the conventional application techniques and shows you how to get a really great trim. 

I redid the caulking around my tub two years ago, and it is a thing of beauty. 

He has you use a silicone shaping tool, and the set he suggest is a little on the expensive side; it’s about $30 now. You can get less expensive versions that have a slightly fewer features. In my case, I didn’t need all the bells and whistles, so I spent about nine dollars and got one of those other kids. I had to pay close attention to be sure I got one with a big enough corner; they come with all these different corners on them or how big of a beat you get, and I needed a slightly larger one than most people.

https://youtu.be/_DI4hfHM_Hg",TootsNYC,False,20,277,2,43,w4ehxm
error,error,False,0,0,0,0,error
"Plasti-dip is a rubber coating used for putting handles on things, among a million other uses.

https://plastidip.com/",mariemarymaria,False,2,22,2,7,y4d4nj
"grip tape for tennis rackets, handlebar tape for bicycles",PersistentPuma37,False,2,10,1,7,y4d4nj
With the time and cost involved it would probably be cheaper to buy a new one.,Max-Carnage1927,False,1,17,1,5,y4d4nj
Wrap it with black electrical tape. That stuff is tough.,SatansMoisture,False,2,12,1,2,y4d4nj
The foam rubber is leaving a charcoal like mess on my hands.,Twitstein,False,1,13,1,1,y4d4nj
Use a butter knife and gently pry it off to get to the screw.,tastyrobots,False,1,15,1,14,yhq3lp
They are usually a tight press fit. Some multi grips/channel locks. Tape the jaws so you don't damage the caps,Max-Carnage1927,False,4,25,1,4,yhq3lp
error,error,False,0,0,0,0,error
"Reinstall windows, it fixes 99% of problems.",zdenis39,False,2,10,1,7,y72354
"Try running it in safe mode (https://whatsabyte.com/tutorials/start-acer-laptop-safe-mode/). If you are able to, there may be some start up software that is causing issues (check installed software for potential malware). If you have the windows install disk, you can try running a repair.",i_lived_with_dinos,False,5,51,1,3,y72354
Someone caught a virus from pornhub 🤗🤗,scout-124,False,1,8,1,2,y72354
Install Linux,Metastophocles,False,1,2,1,-6,y72354
I use these to bathe my dog. Put them on and rub your hands together.,Early-Series-2055,False,2,17,1,5,yfq0xz
"Pretty much the first thing my sweet kid did was pet the dogs with my brand new dishwashing gloves. Am I resigned to just keep using this little brush to try get the fine hairs out one by one, or is there a better way?",BluesyFloozy,False,3,48,1,3,yfq0xz
Dog fur in what now?,GeminiRanger,False,1,6,1,2,yfq0xz
Those look more like dogwashing gloves than dushwashing gloves.,redEPICSTAXISdit,False,1,10,1,2,yfq0xz
Cover in pva glue and peel it off,dussledorf654,False,1,8,1,2,yfq0xz
Would recommend cutting out old dried  caulking/ compound and sanding it. Would have to re-mud and then re-caulk.,EngineeringNo5958,False,2,25,1,6,ybhrii
"Honestly, that windowsill shouldn't look like that. Either they put a new layer of drywall or someone inexperienced installed it. 

If I were you I'd borrow a multi tool and cut the sides out or a chisel and shave the sides down enough to use plaster. Sand it flush to the wall and then paint over it. It will look a lot better!",Almenontour,False,6,72,2,3,ybhrii
"Chisel out all that old putty/caulk and sand the wood a little if needed, then paint the wall first, then the trim.",bpfrocket13,False,3,27,1,2,ybhrii
Search plate hanging hardware.   What I’m thinking off has hooks that secure the top and bottom and are attached by springs.  Then has a mounting loop between the springs.,deedubdub,False,4,35,1,300,wadznk
How big and how heavy? There isn’t a banana for scale,jcmatthews66,False,2,13,1,46,wadznk
Plate holder bracket,blacksewerdog,False,1,3,1,36,wadznk
"This looks like something that would magically float in the air on its own.

But seriously, about how much does it weigh? Do you think a command strip would adhere to it and be able to support it? They typically don't leave any residue and are pretty durable.",HHAAUUNNTT,False,5,55,2,82,wadznk
"Metal plate hanger. You will probably need to adjust the prongs with a pair of pliers to accommodate the thickness of the piece.  If you really want to get fancy, spray paint the hanger with black enamel paint so it blends better to showcase that beautiful piece of art!",No_Albatross5110,False,5,54,1,13,wadznk
"They work with pressure... sometimes , over time, the rubber seals lose the softeners get hard and break.
This creates a gap where the pressure is leaking.
The best thing is to carefully try to disassemble everything. Go to the next hardware store with the rubber seals and get new in that size. 
Put everything carefully together, et voilà. 
Try to change all the seals in question at once. 
If you are not sure how to do something you can pm me.",Hooks_left_hand,False,10,97,1,10,xx1r5p
If the nozzle and white piece at the bottom are not clogged then try putting a couple drops of any oil on the plunger stem and let it run down inside the pump mechanism,Haunting_Ad_6021,False,1,34,1,2,xx1r5p
