explanation_text,author,is_author_ct,explanation_sentence_count,explanation_word_count,explanation_nesting_level_count,explanation_score,parent_submission_id
Might you be holding it upside down and the cross bracket at the bottom being the means to mount it to the wall?,jrotvold,False,1,24,1,11,y3m1mo
"I believe you use that bar to hang it, not sure on the details but that's the only way I can see atm",Tulak2583,False,2,25,1,3,y3m1mo
DIY... Drill It Yourself,Agent_Drizzle,False,2,5,1,3,y3m1mo
"I wonder if, originally,  there was some type of horizontal mounting bracket that attached to that bar?",anti-socialmoth,False,3,21,1,2,y3m1mo
Hanging sconce?,servetheKitty,False,1,3,1,1,y3m1mo
"You need to cut the seam at the beginning of the zipper(right side in pic) so you have access to the ends of the zipper tape. Remove the zipper pull and use a pair of pliers to bend it closed a little, then restart the pull on the loose ends of the zipper tape. Hand sew the seam back at the beginning.",guambob,False,4,67,1,2,ytdj32
Use a fork!,gazHC,False,1,4,1,1,ytdj32
"You need to know where the power is supposed to come from to that outlet. Go buy an outlet tester, plug it in and it will tell you if you have power but no ground or a couple of other possible problems. If you are going to visually inspect it shut off your main breaker and put tape over it so no one in the house goes down and turns it back on.",airbiscuit,False,4,77,1,1,yd75tb
Sometimes a GFCI outlet somewhere will trip and affect other outlets. Check in closets and to see if there are any tripped outlets or light switches turned off. You can get a tester that is shaped like a pen and will fit into the hot side of the outlet. You can use that to probe the wires to see if they are getting power.,dinoaids,False,4,68,1,1,yd75tb
Yes blue and brown are European wiring colors. So blue to black and brown to white in the USA,Haunting_Ad_6021,False,2,20,1,2,ysnbi7
You don’t. Screens fecked.,Gasman0187,False,2,7,1,6,y590ws
Oooo…by paying a technician to switch out your screen. Good luck.,MrCrunchyOwl8855,False,2,15,1,5,y590ws
"https://www.ifixit.com/Guide/Nintendo+Switch+LCD+Replacement/117395

Here is a guide and parts on how to do it.",YoureMrLebowski,False,1,14,2,1,y590ws
"Take the black with the knot in it and connect it to the black in your hand with the dashes on the jacket.

Take the other black in your hand, the black from the motor, and the two whites and connect them together.

That's my best guess based on what you have pictured.",festerwl,False,5,61,2,2,ygsf1t
The white cords on the right go to lights inside the decoration. The black cords on the bottom go to the plug. The black cord on the left and the red cord go into the motor. I have wire nuts and electrical tape but dont know which wires would go together.,jshit9,False,4,56,1,1,ygsf1t
Shady AF,kitten0077,False,1,2,1,1,ygsf1t
"Mine did the same thing and I figured the fan motor went bad. Ended up taking the vent cover off, gave it a good cleaning and sprayed some WD40 on it and it's working still. Sometimes the dust can screw up the connections.",goliath276,False,5,48,1,9,xyyt1i
"Some of those fans have an outlet built in behind the vent cover. If so, you could plug something in and see if it works with the switch turned on.  If it doesn't, get or borrow an inductive type electrical tester and see if there's power in the wire running to the fan with the switch on.

If the fan isn't getting power, it would be best to hire an electrician since there are more possibilities than just a bad switch.",pauciradiatus,False,7,93,2,2,xyyt1i
error,error,False,0,0,0,0,error
"20 days early, that’s November",bot_22546,False,2,7,1,3,xy1rbh
"Never seen one, but here's my guess.
Those two tabs with A on them look to be what secures the faucet to counter. Are those black caps that come off? If so, you may be able to tighten there to secure. 

If not, it will have to be from above, and this is what I think is the way. Loosen the set screw, lift the faucet mechanism up (it's probably going to be corroded on, to some gentle wiggling, maybe some spray lube to help free it up), this should expose the mounting hardware that secures the faucet to counter.",Reelair,False,15,120,2,2,xy1rbh
What's the model?,ZeNobodyOk,False,1,5,1,1,xy1rbh
"there's a special tool for it, just ask at a do it yourself market, or Google it. It sucks but you need to buy it I fear",D-Bater,False,4,31,1,1,xy1rbh
"Does anyone attempt to do any research before they post these threads?

If you google how to tighten sink faucet, and look at the images one of the first 5 images is exactly what you have, with a link to a reddit thread.

This whole subreddit seems to be full of people too lazy to actually attempt to look at what they're doing.

The set screw does do something by the way, but you clearly garbled the head because you don't know what an allen key is.

https://www.reddit.com/r/Plumbing/comments/d9tnpd/kitchen_faucet_is_loose_need_help_for_how_to_fix/",SugarbearSID,True,6,101,2,1,xy1rbh
"Shouldn't we try to address the reason *why* it burned out before we go replacing it? The mica is there to shield from arcing around the magnetron. Judging by the pictures this appears to have charred the shield pretty well. I would investigate if this is a fire hazard and worth fixing or rather if it would be safer to just replace especially if your mother is elderly or lives alone and may not have access to help if this were to cause a fire. Just food for thought. This is not legal advice, I am not a doctor, blah, blah. All wrongs reserved.",LeftHandedAnt,True,10,117,1,258,wcprq9
"Mine has a message by this part saying do not use without mica plate.

Specifically, DO NOT REMOVE THE LIGHT BROWN MICA COVER ON THE MIDDLE RIGHT HAND SIDE OF THE OVEN CAVITY. OPERATING THE OVEN WITHOUT THIS COVER IS DANGEROUS AND COULD CAUSE A HAZARD. 

It’s not even by this part, it’s on the inside of the door as you open it on a non-removable sticker so I feel like they want you to take the warning seriously.",blackcurrantcat,False,8,91,2,28,wcprq9
Following as I have the same issue.,simonna77,False,1,8,1,9,wcprq9
"Replaced mine.
Just bought a replacement part online.

I think it’s made of Mica. Basically you can buy a replacement square one or buy a custom for your microwave model. I did the later. But it looks like you could cut a square one to shape.",king_atom007,False,6,55,2,22,wcprq9
Time for a new microwave.,dankestofdankcomment,False,1,6,1,5,wcprq9
Vinegar will do,Nachtflug_NKT,False,1,3,1,114,wpr8aq
Vinegar,zeighArcher,False,1,1,1,8,wpr8aq
I've already tried using dish soap and a baking soda paste but they always come back when the sink gets dry again.,TG_Officials,True,1,24,1,3,wpr8aq
Acid.,Cuntable,True,1,2,1,3,wpr8aq
Have the same sink and hate those white stains.,pandiliza,False,1,10,1,3,wpr8aq
"Don’t sand this. This is veneer on particle board, you’ll sand through the veneer. There isn’t much you can do for this, Your best bet to to clean it with some soap and water. You can try to add a new clear coat like shellac but try it in a hidden area before you do the whole piece.",putternight,False,6,67,1,24,x54of7
"You should be able to tell if it’s real wood by looking at the back or bottom. If it’s veneer on particle board those surfaces likely won’t have it. If it’s wood, you can sand it and refinish it or sand it lightly and paint it. But you’ll want to prime it with a stain blocking primer that will not allow the wood grain to show through.",Cophia,False,5,77,1,4,x54of7
"Is it real wood? And as for sand paper, go ask the Home  Depot dudes. It'll likely require a couple different kinds.",EquivalentVirus9700,False,4,28,1,2,x54of7
Put a price tag on it,Muroooh,False,1,6,1,2,x54of7
Thank you all for your help!,tetebyceleste,False,1,7,1,2,x54of7
"The leakage after the valve is closed comes from the stored pressure in the hose that is connectet, it acts like a blown up ballon.",kuerbis3000,False,2,27,1,198,vwos4z
"I would completely remove the hose and see if it still leaks.

That tells you it is a gasket in the hose end or a problem in the valve itself.",Dirk_The_Cowardly,False,2,33,2,75,vwos4z
error,error,False,0,0,0,0,error
Your hose could just need a new o-ring. Those backflow preventers should stay on though (or be replaced).   Go to any hardware store and ask for a garden hose o-ring ($0.30/piece usually) and see if that doesn’t clean up the connection first. Good luck bud.,yumyan,False,4,62,1,40,vwos4z
Looks like it has one of those backflow preventers on it.. Take that off...,sfmiller1,False,2,16,1,42,vwos4z
"omg I just notice its the kanto starter pokemons  
they're so cute!",YukiColdsnow,False,1,15,1,10,xajzkx
Thanks for the update!,sanneh51,False,1,5,1,7,xajzkx
yey!,jbug5j,True,1,2,1,4,xajzkx
Cool ass rug you have there,_HIST,False,1,6,1,5,xajzkx
Glad you got em to stay up there :],Koolaid143,False,1,9,1,3,xajzkx
The wall wasn't cleaned before it was painted. You could probably peel that paint job off in sheets.,Thecleaner1975,False,2,21,1,3,y2qe6u
"There’s these minimal damage wall hooks for hanging photos you can get… they look like a massive fishing hook that you can just push into the wall (not on a stud) and it creates only a pinhole and holds a decent weight. 
You can grab them with pliers and pull it out with pliers with virtually no damage. Then if you’re really worried you could fill with a dot of dap or drywall putty to repair. 

You can get them on Amazon, hardware stores etc.

https://www.leevalley.com/en-ca/shop/hardware/picture-hanging-and-framing/hangers/52367-monkey-hook?item=00F1450&utm_source=free_google_shopping&utm_medium=organic&utm_campaign=shopping_feed&gclid=CjwKCAjw7p6aBhBiEiwA83fGugqaDGYwTKFKEJP3GWjR2VhoJVHW0T7L785d2UyHyFldagviQ-yEHBoC-7YQAvD_BwE",froggerpunk,False,6,99,2,2,y2qe6u
"Adhesives either not sticking or keep on falling, not sure if it's because of the paint that the owner used or what. Im just a tenant so i cannot use nails for decorations. Thank you!",WinnieDPoota,False,4,42,1,1,y2qe6u
"See how there is a little gap by the ceiling? That’s the trick. Here’s how I’ve seen them work:

Hold that entire frame “by the waist” and push up toward the ceiling. You don’t need to press hard or scrape it against the ceiling. While pushing upward, slide a long edge to the side. One long edge will now be able to swing down, and the other long edge will stay attached as a pivot point.",AndMarmaladeSkies,False,8,92,2,10,y1p3q6
"If you remove those pieces of insulation attached to the floor. There will be alot more reverb on that particular story and footsteps will be much more noticeable. I would personally put up unfinished drywallpannels, osb, or drop down ceiling. Up to you.",SafelyBurning,False,6,49,1,3,xjmm71
Remove it and do some spray foam and then cut to desired shape with a razor blade.,gshibby03,False,1,18,1,3,xjmm71
error,error,False,0,0,0,0,error
Leave insulation. Add a strip of wood on each of the floor joists to nail or screw to. Cut a piece of plywood to fit into the hole and secure to the two strips of wood.,WH0SAYSTHISSHIT,False,3,39,1,2,xjmm71
If it’s up north they could keep the floor above a couple degrees warmer. Need a vapour barrier. Spray foam and poly would help.,Heckler4,False,3,28,1,1,xjmm71
Either color matched grout or color matched sanded grout caulking. You can chip out a piece of the existing grout and take it with to a flooring/tile store and have it matched to one of their available colors.,U_oOkay-Buddy,False,2,42,1,3,ylobp1
Ceramic glue; it’s designed for this.  Superglue will work in a pinch though.,Em_Adespoton,False,2,18,1,2,ybttos
"Try some super glue, best you can do unfortunately.",upsidedownes,False,2,11,1,1,ybttos
"Gorilla glue, maybe a heat gun/hair dryer too",alyisdead,False,2,11,1,1,ybttos
"E6000 is the correct adhesive to repair ceramic.

My mom teaches pottery.",gandhikahn,False,2,15,2,1,ybttos
The sharp end is in the cap to poke it open.,Gingerninje,False,1,12,1,927,vft7u3
Usually the cap you unscrewed has a spike,winbatch,False,1,8,1,156,vft7u3
"I love the honest, good hearted instructions for people who didn’t have someone teach them things that we take for granted.

I like the sarcastic ones too",Wonderful_League_237,True,3,31,2,74,vft7u3
Look at the cap and see if it has a cone point inside the top area. Flip the cap over and push down to puncture,BJMRamage,False,2,26,1,80,vft7u3
"I always use a chainsaw, works like a charm.",420jeff,False,2,11,1,167,vft7u3
Barkeepers friend,ArtBaco,False,1,2,1,6,xvkd0j
Try magic eraser,Myrpachu,False,1,3,1,7,xvkd0j
"It would be weird for those to have been caused by tools since there's no reason to use tools on that area, but if they are just surface smudges, bathroom cleaner lik Comet or something similar should take them off. If it doesn't, I'd guess they're actually scratches and I'm not sure whether they can be fixed",Tall_Struggle_4576,False,6,66,1,3,xvkd0j
"Marks or cracks?

Can you return it?",thisisntshakespeare,False,2,10,2,2,xvkd0j
Dishwasher tablet dipped in hot water?,happylurker233,False,1,7,1,2,xvkd0j
"You can heat it up with a hair drier to make the adhesive give. Just be careful if it's a plastic sticker,  heat slowly.
Sliding a razor blade under it would be fast but obviously you could cut the sticker with the slightest slip",xaillisx,True,4,50,1,3,y41g3i
Razor blade between sticker and glass. Once you get it started hold it with one hand and pull lightly as you slide the razor between the sticker and glass,jetty_junkie,False,2,30,1,3,y41g3i
"Smash window, remove glass pieces with tweezers.",NP_equals_P,False,2,9,1,5,y41g3i
"Soak it in soapy water before you use a blade. Keep the blade at 45 deg to the glass. Heat will soften the glue but it will also soften the plastic of the sticker and it may stretch when you pull it off. That said removing it on a warm day is your best chance. If you do remove it in one piece, the glue will never be as adhesive as it was when you first applied and you will need to apply a glue product to install it. Good luck and hopefully its ""purr""fect (sorry had to say that)...",VicCan001,False,7,110,1,2,y41g3i
Heat gun,aetySoldier,True,1,2,1,1,y41g3i
Turn 1/4 and pull,blacksewerdog,False,1,4,1,2,y2nf8i
"Mine sometimes get stuck if there is water in the sink, if there is water in the sink try removing some",Opening_Revenue_314,False,2,22,1,2,y2nf8i
Turn counter clockwise about 1/4th turn and lift,kitten0077,False,1,8,1,1,y2nf8i
"Adding in case it wasn’t clear- it is STUCK. I am fully aware of how to remove one normally, I have used them for years- it will not turn at all. Not sure what else to try. The handle gets hardly any grip otherwise I would use pliers, they keep slipping off. Any ideas?",aveell,False,7,62,1,1,y2nf8i
Do you think it is stuck because you missed the thread or because of corosion?,hurricane4242,True,1,16,1,1,y2nf8i
"Is your dryer vented upwards? It will take longer to dry clothes if so. Check to make sure the vent pipe is clean. Often there is a critter screen on the outside port, that gets clogged easily.",TheLawnmowerLady,False,5,42,1,61,wodjum
It’s the vent pipe/exhaust. Get it cleaned out.,Cant-b-tkn-seriously,False,2,13,1,82,wodjum
Are you cleaning out the screen each time you run it? Have you checked the discharge vent for lint buildup?,artwonk,False,2,22,1,18,wodjum
Vent is clogged been doing this for 43 years,smalldog1a,False,1,9,1,13,wodjum
"If it’s gas, my dryer started doing this exact thing. We thought it was humidity too. Turns out it needed a new igniter and wasn’t actually drying.",OGdoritobutt,False,4,33,1,11,wodjum
I would take this to a specialty print shop. Most remaining former camera shops have transitioned to printing only and specialize in these kinds of tasks.,bsimpsonphoto,False,2,28,1,3,yf9kk9
"Microsoft paint, the software that comes free with Windows, will let you print parts of an image on different papers on standard printers which you can physically join later.",PoliteGhostFb,False,3,32,1,2,yf9kk9
"you can get a 16x20 poster on paper board printed at walgreens for $13.50, if it doesn't need to be high quality, split up and print yourself",eriffodrol,False,3,31,1,2,yf9kk9
"If you don’t care about the quality, it’s cheap to make blueprint pics at kinkos/fedex. Will be black and white and look like an 80’s punk flyer. I did that with my art. Just a heads up. I can look up what it’s called if interested.",ChondroArt,False,6,58,1,1,yf9kk9
error,error,False,0,0,0,0,error
"Cover the area with a thin layer of fabric felt. Use ,3m spray adhesive to glue it. Forget removing that mess.",tenshii326,False,4,26,1,85,w8jvvr
Try a heat gun.,Kenneth-Kebab,False,1,5,1,16,w8jvvr
WD-40 is possibly your friend here. I use it to remove adhesive and stickers all the time. Worth a try because I know you have some WD-40 on hand.,OffMyRocker2016,False,3,32,1,5,w8jvvr
Try nail polish remover - mineral spirits and lacquer thinner would probably work but will leave a bad lingering smell,MichaelFusion44,False,1,20,1,18,w8jvvr
Wet leaves bad,RanmanGT1,False,1,3,1,2,yf1qgm
Remove the blower tube and attach the bag. The big tube attaches to the suction port once you remove the guard,Haunting_Ad_6021,False,2,22,1,1,yf1qgm
"Turn it the other way up? Seriously, you’ll never balance your plate on there - no wonder it’s wobbly",geefunken,False,3,23,1,7,xviszx
"Is it wobbling where the top meets the legs or the legs are uneven? 

The metal feet might unscrew to help with balance?",Usernamenomnomnom,False,3,26,2,2,xviszx
Definitely a support beam,Embarrassed-Ad-1639,False,1,4,1,1,xviszx
Turn it over?,ironxy,False,1,4,1,1,xviszx
Crossbracing,imnotbobvilla,False,1,1,1,1,xviszx
"Also, are you sure that’s a pepper grinder?? Does it have an on/off switch?",dumbthoughtperson,False,3,21,1,3,xr8sie
"not enough views, but should be a screw somewhere",jtmarlinintern,False,2,10,1,3,xr8sie
"Should be a release screw or a twist latch on the bottom where the pepper comes out,look at the bottom sometimes it releases down there or release’ the top to pour the peppercorns in!",Relaxedtiger330,False,2,38,1,2,xr8sie
Picture of the bottom?,__DeezNuts__,False,1,5,1,2,xr8sie
"Just pull the top part up. No screw, no srew-top.

On the downside you can change only the grinding degree.",Alprausch84,False,4,27,2,2,xr8sie
Hulk smash,Difficult-Habit-4001,False,1,2,1,3,x3jyt9
It should pull found not twist or turn. Just the clear piece.,nanbr340,False,2,14,1,10,x3jyt9
 Try gently pulling the glass bulb straight down,brian_m1982,False,2,9,1,3,x3jyt9
"I had a light fixture that had those bulbs, not exactly since yours has a screw base but I had the halogen bulbs that push in and pull out. Anyway, searched high and low for the dumb bulb, replaced it and found out the damn fixture was bad.",Impossible-Aide-3879,False,5,53,1,2,x3jyt9
"Op you have a 50W. E11 bulb, you’ll find an LED replacement.",I_mostly_lie,False,2,15,1,2,x3jyt9
"Stretch it little bit with - screwdriver, insert it and squeeze a bit with pliers(but not too much).",TeeKey1,False,2,21,1,7,xkwcwe
"I have never done it, but i have seen it done.  at the start of the zipper, that you are trying to connect, pop off a few of the teeth, as close to the start as possible, this should give you access.  good luck",jtmarlinintern,False,8,53,1,3,xkwcwe
Zippers are much easier to fix than people realize. Normally the problem is the slider has stretched. Take a pair of pliers to make the opening on the broken side of the slider more closed. I watched a video on YouTube a few months ago and it worked like a charm.,BubbleGooseVids,False,4,55,1,1,xkwcwe
Either Goof Off or WD40 can remove most glue residues.,Dieg0Neruda,False,1,11,1,5,xhkx90
I used an [adhesive removing disk for a drill](https://www.autozone.com/wash-cleaners-and-exterior-care-products/bug-tar-paint-and-decal-remover/p/3m-adhesive-eraser-wheel/503214_0_0) to remove some similar residue.,Hulkslacks,False,1,49,1,6,xhkx90
Gently heat the area with a heat gun or hairdryer to loosen the adhesive. The remaining adhesive can be removed with a microfiber cloth and isopropyl alcohol.,jaroftoejam,True,2,29,1,8,xhkx90
 Isopropyl,Techyness,True,1,2,1,3,xhkx90
Slowly pull off any remaining tape (if any) as best you can without it breaking Experiment with different angles and speeds of pulling. Any remaining residue can be removed by rubbing with automotive cutting compound on a rag.,johnjohn4011,False,2,42,1,1,xhkx90
"If you're thinking about buying these to wash dishes, don't. They are pretty useless, you cannot hold on to the dishes at all, they slip right out of your hands, especially if they're glass and/or heavy. I got them for my kids and thought they were trying to get out of chores when they said they cannot hold on to anything with them but I tried, it's true.

But thanks everyone for the dog washing suggestions they're great for that!",BluesyFloozy,False,10,97,2,1,yv6hv9
Is it hitting those screws sticking out? They should be flush against the metal. Also are the tracks greased up? Should be a small amount of grease for easier sliding.,DreadPirateCrispy,False,4,34,1,1,y28qw2
silicone grease on the sides of the runner,HugoAyala,False,1,8,1,1,y28qw2
"Spray WD-40 into the track, or apply a thin coat of petroleum jelly.",These_Lingonberry635,False,2,15,1,1,y28qw2
Heat gun to melt the plastic and wipe off?,Majestic_Food_4190,True,1,10,1,6,y6f41u
"try the inverse........... ice, froze it (put some ice on bag), and try to remove it while its hard",HugoAyala,False,3,24,1,1,y6f41u
Plastic razor blade,Zehnerm2,False,1,3,1,1,y6f41u
You mean EX girlfriend?,Astronaut_at_night,False,1,5,1,-1,y6f41u
"You just need a solvent. Acetone, rubbing alcohol, nail polish remover, any strong solvent will help break down the bond.

Apply it, wait a few minutes then rub with a cloth. Depending on the solvent strength, you might need to repeat a few times, but that’s it.

You could buy proprietary glue remover, if you want to be sure, however it’s cheaper not to.",Timbershoe,False,12,81,2,22,wy2scd
error,error,False,0,0,0,0,error
Human sweat will remove allllll kinds of stuff according to the Simpsons,HellofaHitller,False,1,12,1,2,wy2scd
"try baby oil (or any oil) and let it set for 10-15 mins, usually works for me.",ohwellitsaghost,False,2,23,1,2,wy2scd
Nail polish remover on a cotton ball,michaelshreds,False,1,7,1,2,wy2scd
Big box stores sell those pull chain switches. u need to remove it and see how many wires it has on it.,Ardothbey,False,2,24,1,146,vakcla
"You can buy a replacement part just for the chain on Amazon. 

The light chain on my fan stopped having enough tension to trigger the light on. 

Bought a replacement part ~ $8 for 2 replacements. 

Less than 10 minutes and a YouTube video. 

Fixed.
[edit - video on you tube](https://m.youtube.com/watch?v=H0-fJBmDq-g)",paperfences08,False,7,72,2,88,vakcla
The kid or the fan?,atika,True,1,6,1,402,vakcla
"Not going to be fun. You have to buy a replacement pull chain switch. Then take fan apart and replace. Usually, those types of mini switches are rated 10A and 250V. You could check your first but it won’t be more than either of those.",JustJay613,False,5,51,1,90,vakcla
you'll probably have to throw away the whole kid at this point.,OrbitingFred,True,1,14,1,24,vakcla
"I need to drop the front differential to change the oil pan. This is the bolt on the passenger side. The nut came off no problem, and the bolt will turn but won't come out. I've tried PB Blaster, tapping with a hammer, and prying. My next step would be heat, but I'm afraid to try it without knowing what the mount is made out of. Probably steel, but maybe rubber?

Any advice is welcome.",JeKuhns,False,12,91,2,1,y5jhc0
"Clean with Dawn dishwashing fluid and dry.  It works great for sticky or greasy surface filth. Also, nicotine is water soluble. 
Do a coat of Killz primer then paint it. 
The Killz will help suppress residual nicotine odors.",Shepsdaddy,False,6,47,1,3,y9tfer
"I would skip the cleaning and thoroughly sand the varnish off. Then clean thoroughly to remove the dust from sanding, then primer and paint. Painting over varnish could result in the paint bubbling up and peeling if the varnish isn’t removed.",InkdScorpio,False,4,46,1,2,y9tfer
"Sanding would be best for a long term item, wash and prime for a few years longevity",dth1717,False,2,18,1,1,y9tfer
Get all-around (galvanized strapping) and wrap it around the metal and fasten it on either side to the wood.  Yes it would weaken it.,ElectronHick,False,2,31,1,1,yknao5
"There is a screw on the end of the arm that moves the float up and down, Move the float down about 1/8 inch, that should take care of it.",heydroid,True,3,33,1,174,vqxx0c
"Check both the float and flap. If the float just keeps falling just replace the whole thing, it's like a 15 dollar quick fix.",getyourcheftogether,False,3,28,1,54,vqxx0c
"First try lowering the height of the float.  It doesn't look to me like the float arm is all the way up.  The float slides up and down the main column but its height is adjusted by a screwhead at the top of the adjustment rod. Turn left to send it farther down,  to try to lower the water level. 

If it's as far down as it can go and still overfilling, these Fluidmaster fill valves generally only fail two ways:

1) slow or no fill. Solution: replace the diaphragm, or

2) won't stop filling despite fully raised float arm.  Solution: replace the entire fill valve.

If the valve was stopping the fill before and now it doesn't,  I'd say it has worn out and it's time for a new one.",theonetrueelhigh,False,13,163,2,29,vqxx0c
I just did this today on my toilet.  Replace the guts.  It is an easy job.,mwgreen00,False,3,21,1,50,vqxx0c
